Aleph system no.,Country code,Language code (008),Language code (041),DDC,Personal author,Author_review_status,Author_birth_year,Author_death_year,Author_name_clean,Author_reconciliation_status,Author_Wikidata_label,Author_Wikidata_QID,Corporate author,Title,Title_clean,Edition,Imprint,Series,Subjects,Other personal authors,Other_personal_authors_clean,Other_authors_structure,Other corporate authors,DOM ID,Type,Genre
014832268,|||,und,,,"WILSON, Joseph, Song-writer, of Newcastle-upon-Tyne.",unchanged,,,"WILSON, Joseph, Song-writer, of Newcastle-upon-Tyne.",none,,,,"Tyneside Songs and Drolleries, Readings and Temperance Songs ... Collected edition. [electronic resource]","Tyneside Songs and Drolleries, Readings and Temperance Songs ... Collected edition.",,"Newcastle-on-Tyne : T. & G. Allan, [1890?].",,,,,,,lsidyv31a1e111,song,Music
014832286,|||,und,,,,missing,,,,blank,,,,"Win Her and Take Her, or, Old Fools will be meddling. A Comedy, etc. [in five acts, and in prose with songs, by J. Smith, M.A. With a dedication by C. Underhill.] [electronic resource]","Win Her and Take Her, or, Old Fools will be meddling. A Comedy, etc. [in five acts, and in prose with songs, by J. Smith, M.A. With a dedication by C. Underhill.]",,"London : J. Hindmarsh, R. Bently, A. Roper & R. Taylor, 1691.",,,"D'Urfey, Thomas, 1653-1723. -- SMITH, John, M.A., Dramatic Writer. -- UNDERHILL, Cave.","D'Urfey, Thomas, 1653-1723. -- SMITH, John, M.A., Dramatic Writer. -- UNDERHILL, Cave.",multiple: dash,,lsidyv345ec0f4,song,Music
014832611,|||,und,,,"Wyatt, Edgar, librettist.",unchanged,,,"Wyatt, Edgar, librettist.",none,,,,"Count Tremolio: comic opera, in three acts. Libretto by E. W. Music by A. R. Watson. [electronic resource]","Count Tremolio: comic opera, in three acts. Libretto by E. W. Music by A. R. Watson.",,"Printed for the Proprietors; Nottingham, 1887.",,,,,,,lsidyv3492edbf,opera,Music
014832731,|||,und,,,"YOUNG, Jane, Poet.",unchanged,,,"YOUNG, Jane, Poet.",none,,,,Songs and Verses. [electronic resource],Songs and Verses.,,"pp. 96. H. R. Allenson: London, 1896.",,,,,,,lsidyv39451b5c,song,Music
014832755,|||,und,,,"ZEBULUN, Joseph.",unchanged,,,"ZEBULUN, Joseph.",none,,,,"Songs of Royal Sion, the Revelations of Christ Jesus ... to the Twelve Tribes of Israel New; and published according to the revealed will and command of the Almighty Lord God ... Second edition. [electronic resource]","Songs of Royal Sion, the Revelations of Christ Jesus ... to the Twelve Tribes of Israel New; and published according to the revealed will and command of the Almighty Lord God ... Second edition.",,"London : J. Zebulun, 1831.",,,,,,,lsidyv3abeef1f,song,Music
014832781,|||,und,,,"Lewis, M. G. (Matthew Gregory), 1775-1818.",standardised,1775,1818,Matthew Gregory Lewis,matched,Matthew Gregory Lewis,Q121060,,"Rich and poor. A comic opera, in three acts, etc. [electronic resource]","Rich and poor. A comic opera, in three acts, etc.",,"London: W. Oxberry; sold by Sherwood, Neely & Jones, 1812.",,,,,,,lsidyv30a595de,opera,Music
014839243,|||,eng,,,,missing,,,,blank,,,,[Notions of the Americans; picked up by a travelling bachelor [i.e. James Fenimore Cooper].] [electronic resource],[Notions of the Americans; picked up by a travelling bachelor [i.e. James Fenimore Cooper].],[Another edition.],"Philadelphia : Carey, Lea & Carey, 1833.",,,"Cooper, James Fenimore, 1789-1851.","Cooper, James Fenimore, 1789-1851.",single or unclear,,lsidyv35028b1b,opera,Music
014839439,|||,ita,,,"BÒTTEGO, Vittorio.",unchanged,,,"BÒTTEGO, Vittorio.",unreconciled,,,,"Viaggi di scoperta nel cuore dell'Africa. Il Giuba esplorato sotto gli auspici della Società geografica italiana. Con 143 incisioni e 4 grandi carte geografiche, etc. [electronic resource]","Viaggi di scoperta nel cuore dell'Africa. Il Giuba esplorato sotto gli auspici della Società geografica italiana. Con 143 incisioni e 4 grandi carte geografiche, etc.",,"Roma, 1895.",,,,,,,lsidyv358efa38 -- lsidyv36601581,opera,Music
014839548,|||,eng,,,,missing,,,,blank,,,,"The Poll on the Election of a Representative in Parliament, for the County of Cambridge ... October, 1831; to which is added, a list of the members for the county, from 1660, till the present time. By Charles Henry Cooper. [electronic resource]","The Poll on the Election of a Representative in Parliament, for the County of Cambridge ... October, 1831; to which is added, a list of the members for the county, from 1660, till the present time. By Charles Henry Cooper.",,"Cambridge : Benjamin Bridges, 1831.",,,"COOPER, Charles Henry.","COOPER, Charles Henry.",single or unclear,,lsidyv32d04301,opera,Music
014839550,|||,eng,,,"CAMPBELL, John, Major-General, C.B.",unchanged,,,"CAMPBELL, John, Major-General, C.B.",unreconciled,,,,"[Narrative by Major-General John Campbell of his Operations in the Hill Tracts of Orissa, for the suppression of human sacrifices and female infanticide.] [electronic resource]","[Narrative by Major-General John Campbell of his Operations in the Hill Tracts of Orissa, for the suppression of human sacrifices and female infanticide.]",[Another edition.] A Personal Narrative of Thirteen Years Service amongst the Wild Tribes of Khondistan for the Suppression of Human Sacrifice. [Revised and in part rewritten. With plates and a map.],"London : Hurst & Blackett, 1864, [1863].",,"Infanticide India Orissa. -- Sacrifice, Human India Orissa.",,,,,lsidyv32d6b436,opera,Music
014839580,|||,ita,,,"CECCHI, Antonio.",unchanged,,,"CECCHI, Antonio.",none,,,,L'Abissinia settentrionale e le strade che vi conducono da Massaua. Notizie a corredo di due grandi carte geografiche redatte in base alle più recenti scoperte. [electronic resource],L'Abissinia settentrionale e le strade che vi conducono da Massaua. Notizie a corredo di due grandi carte geografiche redatte in base alle più recenti scoperte.,,"Milano, 1887.",,,,,,,lsidyv358f24ed,opera,Music
014840004,|||,eng,,,,missing,,,,blank,,,,"Property Register, Folkestone. [electronic resource]","Property Register, Folkestone.",,"Folkestone : Eiloart & Temple, [1889]",,,,,,,lsidyv35502c4d,opera,Music
014840021,|||,eng,,,"FORTESCUE, F., Dramatist.",unchanged,,,"FORTESCUE, F., Dramatist.",none,,,,"Robinson Crusoe; or the island of Juan Fernandez. An operatic drama in three acts, etc. [In prose. Founded on D. Defoe's work.] [electronic resource]","Robinson Crusoe; or the island of Juan Fernandez. An operatic drama in three acts, etc. [In prose. Founded on D. Defoe's work.]",,"Boston, 1822.",,,"Defoe, Daniel, 1661?-1731","Defoe, Daniel, 1661?-1731",single or unclear,,lsidyv3599c42b,opera,Music
014840114,|||,eng,,,"GLYDE, John.",unchanged,,,John Glyde,matched,John Glyde,Q18671731,,"The Norfolk garland: a collection of the superstitious beliefs and practices, proverbs, curious customs, ballads and songs, of the people of Norfolk, as well as anecdotes, etc. [electronic resource]","The Norfolk garland: a collection of the superstitious beliefs and practices, proverbs, curious customs, ballads and songs, of the people of Norfolk, as well as anecdotes, etc.",,"London : Jarrold and Sons, [1872]",,,,,,,lsidyv317c3808,song,Music
014840117,|||,ita,,,"GODIO, Guglielmo.",unchanged,,,"GODIO, Guglielmo.",none,,,,Vita Africana. Riccordi d'un viaggio nel Sudan Orientale. Opera ... illustrata. [electronic resource],Vita Africana. Riccordi d'un viaggio nel Sudan Orientale. Opera ... illustrata.,,"Milano, [1885?]",,,,,,,lsidyv35572610,opera,Music
014840358,|||,fre,,,,missing,,,,blank,,,,"Notice sur les Indiens Ioways ... venus des plaines du Haut-Missouri ... sous la conduite de G. H. C. Melody, Esqre ... Gravures, etc. [electronic resource]","Notice sur les Indiens Ioways ... venus des plaines du Haut-Missouri ... sous la conduite de G. H. C. Melody, Esqre ... Gravures, etc.",,"Paris, 1845.",,,,,,,lsidyv359c988a,melody,Music
014840448,|||,eng,,,"KEIM, De Bonneville Randolph.",unchanged,,,"KEIM, De Bonneville Randolph.",unreconciled,,,,Sheridan's Troopers on the Borders: a winter campaign on the plains ... With ... engravings. [electronic resource],Sheridan's Troopers on the Borders: a winter campaign on the plains ... With ... engravings.,,"Philadelphia, 1870.",,,"SHERIDAN, Philip Henry.","SHERIDAN, Philip Henry.",single or unclear,,lsidyv357b546a,opera,Music
014840595,|||,eng,,,"LIVERMORE, S. T.",unchanged,,,"LIVERMORE, S. T.",none,,,,"A condensed history of Cooperstown, with a biographical sketch of J. F. Cooper. [electronic resource]","A condensed history of Cooperstown, with a biographical sketch of J. F. Cooper.",,"Albany, 1862.",,,"Cooper, James Fenimore, 1789-1851.","Cooper, James Fenimore, 1789-1851.",single or unclear,,lsidyv34fec447,opera,Music
014840682,|||,eng,,,,missing,,,,blank,,,,The co-operative and general guide to Manchester and Salford. Alphabetically arranged. [electronic resource],The co-operative and general guide to Manchester and Salford. Alphabetically arranged.,,"Manchester : Co-operative Printing Society, 1878.",,,,,,,lsidyv34f076b1,opera,Music
014846761,|||,eng,,,"ADAMS, William Davenport.",unchanged,,,William Davenport Adams,matched,William Davenport Adams,Q14948868,,"Songs from the Novelists, from Elizabeth to Victoria. Edited with introduction and notes, by W. D. Adams. [electronic resource]","Songs from the Novelists, from Elizabeth to Victoria. Edited with introduction and notes, by W. D. Adams.",,"London : Ward & Downey, 1885.",,,,,,,lsidyv35c58ff2,song,Music
014846785,|||,eng,,,"Andersen, H. C. (Hans Christian), 1805-1875",standardised,1805,1875,Hans Christian Andersen,matched,Hans Christian Andersen,Q5673,,The Eleven White Swans of Denmark. An opera. (Founded on a Danish tale by H. C. Andersen [by Lavinia Jones].). [electronic resource],The Eleven White Swans of Denmark. An opera. (Founded on a Danish tale by H. C. Andersen [by Lavinia Jones].).,,"Bradford-on-Avon : Daniel Jones, 1864.",,,"Andersen, H. C. (Hans Christian), 1805-1875","Andersen, H. C. (Hans Christian), 1805-1875",single or unclear,,lsidyv35e86934,opera,Music
014846786,|||,eng,,,"ANDERSON, Alexander, of Kirkconnell.",unchanged,,,"ANDERSON, Alexander, of Kirkconnell.",none,,,,"A Song of Labour, and other poems. [electronic resource]","A Song of Labour, and other poems.",,"Dundee : Advertiser Office, 1873.",,,,,,,lsidyv35c5eb7d,song,Music
014846818,|||,ita,,,"AZZONI, Rambaldo degli.",unchanged,,,"AZZONI, Rambaldo degli.",unreconciled,,,,"Considerazioni sopra le prime notizie di Trivigi contenute negli scrittori e ne' marmi antichi. Opera postuma. [Edited, with a life of the author, by G. Pulieri. With a portrait.] [electronic resource]","Considerazioni sopra le prime notizie di Trivigi contenute negli scrittori e ne' marmi antichi. Opera postuma. [Edited, with a life of the author, by G. Pulieri. With a portrait.]",,"Treviso, 1840.",,,,,,,lsidyv35e71ade,opera,Music
014846828,|||,ita,,,"BALZO, Carlo del.",unchanged,,,Carlo del Balzo,matched,Carlo del Balzo,Q3659985,,"Napoli e i Napoletani. Opera illustrata, etc. [electronic resource]","Napoli e i Napoletani. Opera illustrata, etc.",,"Milano, 1885.",,,,,,,lsidyv35e4ebb8,opera,Music
014846863,|||,eng,,,"BELL, Archibald, Advocate.",unchanged,,,"BELL, Archibald, Advocate.",none,,,,Melodies of Scotland. [electronic resource],Melodies of Scotland.,,"Edinburgh : Printed for private circulation, 1849.",,,,,,,lsidyv35e17d0c,melody,Music
014846875,|||,mul,$aeng$adut,,"Belzoni, Giovanni Battista, 1778-1823.",standardised,1778,1823,Giovanni Battista Belzoni,matched,Giovanni Battista Belzoni,Q180339,,"[Narrative of the Operations and Recent Discoveries within the pyramids, temples, tombs, and excavations, in Egypt and Nubia]. [electronic resource]","[Narrative of the Operations and Recent Discoveries within the pyramids, temples, tombs, and excavations, in Egypt and Nubia].",Third edition.,"Brussels : H. Remy, 1835.",,,,,,,lsidyv35bdd4b1,opera,Music
014846896,|||,ita,,,"BIFFIGNANDI BUCCELLA, Pietro Giorgio.",unchanged,,,Pietro Giorgio Biffignandi Buccella,matched,Pietro Giorgio Biffignandi Buccella,Q23887121,,Memorie istoriche della città e contado di Vigevano. Opera postuma ... Corredata di note e di una raccolta di documenti in gran parte inediti [by B. Biffignandi Bucella]. [electronic resource],Memorie istoriche della città e contado di Vigevano. Opera postuma ... Corredata di note e di una raccolta di documenti in gran parte inediti [by B. Biffignandi Bucella].,,"Vigevano, 1810.",,,"BIFFIGNANDI BUCCELLA, Bernardino.","BIFFIGNANDI BUCCELLA, Bernardino.",single or unclear,,lsidyv35c1d5bd,opera,Music
014846936,|||,ita,,,"BOURCARD, Francesco de.",unchanged,,,"BOURCARD, Francesco de.",unreconciled,,,,Usi e costumi di Napoli e contorni descritti e dipinti. Opera diretta da F. de Bourcard. [electronic resource],Usi e costumi di Napoli e contorni descritti e dipinti. Opera diretta da F. de Bourcard.,,"Napoli, 1853, 58.",,,,,,,lsidyv36039b39 -- lsidyv35e4a604,opera,Music
014846961,|||,mul,$ager$aspa$afre$aita,,"BRUNO, Agostino.",unchanged,,,"BRUNO, Agostino.",none,,,,"Le Ultime scoperte Africane e l'opera dei missionari cattolici all'estero. Prolusione, etc. [electronic resource]","Le Ultime scoperte Africane e l'opera dei missionari cattolici all'estero. Prolusione, etc.",,"Mondovì, 1881.",,,,,,,lsidyv35f40ad1,opera,Music
014846962,|||,ita,,,"BRUSCHELLI, Domenico.",unchanged,,,"BRUSCHELLI, Domenico.",unreconciled,,,,"[Asisi città serafica e santuarj che la decorano ... opera ... corredata di XXX rami ... disegnati ed incisi dal signor Giambattista Mariani, etc.] [electronic resource]","[Asisi città serafica e santuarj che la decorano ... opera ... corredata di XXX rami ... disegnati ed incisi dal signor Giambattista Mariani, etc.]",Seconda edizione riveduta e corretta dall'autore.,"Orvieto, 1824.",,,"MARIANI, Giovanni Battista.","MARIANI, Giovanni Battista.",single or unclear,,lsidyv35e191ce,opera,Music
014846995,|||,ita,,,"CAMPORI, Cesare, Marquis.",unchanged,,,"CAMPORI, Cesare, Marquis.",none,,,,Notizie storiche del Frignano. Opera postuma. [Edited by Giuseppe Campori.] [electronic resource],Notizie storiche del Frignano. Opera postuma. [Edited by Giuseppe Campori.],,"Modena, 1886.",,,"CAMPORI, Giuseppe, Marquis.","CAMPORI, Giuseppe, Marquis.",single or unclear,,lsidyv35c0bada,opera,Music
014847001,|||,eng,,,,missing,,,,blank,,,,"Modern Canvassing, or, Popery and No Popery. [A dialogue between an agent and a freeholder.] [electronic resource]","Modern Canvassing, or, Popery and No Popery. [A dialogue between an agent and a freeholder.]",,"Leeds : Edward Baines, 1826.",,,,,,,lsidyv35ccfdd6,opera,Music
014847069,|||,ita,,,"COLDANI, Giacinto.",unchanged,,,"COLDANI, Giacinto.",none,,,,"Cenni storici dell'antico e moderno insigne borgo di Melegnano, raccolti in parte colla scorta della manoscritta descrizione che ne fece il M. R. D. Giacinto Coldani ... ed accresciuti ed a più accurata forma condotti per opera del rev. sacerdote Ferdinando Saresani, etc. [electronic resource]","Cenni storici dell'antico e moderno insigne borgo di Melegnano, raccolti in parte colla scorta della manoscritta descrizione che ne fece il M. R. D. Giacinto Coldani ... ed accresciuti ed a più accurata forma condotti per opera del rev. sacerdote Ferdinando Saresani, etc.",,"Melegnano, 1886.",,,"SARESANI, Ferdinando.","SARESANI, Ferdinando.",single or unclear,,lsidyv35c008d2,opera,Music
014847070,|||,eng,,,"COLE, Edward William.",unchanged,,,"COLE, Edward William.",none,,,,The Best Song Book in the World. Selected and edited by E. W. Cole. [Containing “The Thousand Best Songs in the World” and “The Funniest Song Book in the World.”] [electronic resource],The Best Song Book in the World. Selected and edited by E. W. Cole. [Containing “The Thousand Best Songs in the World” and “The Funniest Song Book in the World.”],,"Melbourne : Cole's Book Arcade, [1892.].",,,,,,,lsidyv35c49741,song,Music
014847071,|||,eng,,,"COLE, Edward William.",unchanged,,,"COLE, Edward William.",none,,,,The Thousand Best Songs in the World. Selected and arranged by E. W. Cole. [electronic resource],The Thousand Best Songs in the World. Selected and arranged by E. W. Cole.,,"London; Cole's Book Arcade Melbourne : Hutchinson & Co., [1892.].",,,,,,,lsidyv35c52c3d,song,Music
014847075,|||,eng,,,"COLLINS, Charles MacCarthy.",unchanged,,,Charles MacCarthy Collins,matched,Charles MacCarthy Collins,Q113808018,,Celtic Irish Songs and Song-Writers. A selection. With an introduction and memoirs. [electronic resource],Celtic Irish Songs and Song-Writers. A selection. With an introduction and memoirs.,,"London : J. Cornish & Sons, 1885.",,,,,,,lsidyv35c4e2f1,song,Music
014847078,|||,ita,,,"COLONNA, Ferdinando.",unchanged,,,"COLONNA, Ferdinando.",none,,,,"Notizie storiche di Castelnuovo in Napoli ... Appendice al volume Scoperte di antichità in Napoli dal 1876 a tutto giugno 1892, etc. [electronic resource]","Notizie storiche di Castelnuovo in Napoli ... Appendice al volume Scoperte di antichità in Napoli dal 1876 a tutto giugno 1892, etc.",,"Napoli, 1892.",,,,,,,lsidyv35c1e364,opera,Music
014847190,|||,ita,,,"E., G. R. B.",unchanged,,,"E., G. R. B.",none,,,,"Memorie o siano Relazioni istoriche sull' origine, nome, fasti e progressi dell' antichissima Città di Nepi ... con un succinto ragguaglio in fine di antiche Città, delle quali si fa cenno nel corso dell' opera. (Di G. R. B. E.) [i.e. G. B. Rangniasci Brancaleau.] [electronic resource]","Memorie o siano Relazioni istoriche sull' origine, nome, fasti e progressi dell' antichissima Città di Nepi ... con un succinto ragguaglio in fine di antiche Città, delle quali si fa cenno nel corso dell' opera. (Di G. R. B. E.) [i.e. G. B. Rangniasci Brancaleau.]",,"Todi, 1845.",,,"RANGHIASCI BRANCALEONI, G. B.","RANGHIASCI BRANCALEONI, G. B.",single or unclear,,lsidyv35e3808a,opera,Music
014847279,|||,ita,,,"FRISI, Antonio Francesco.",unchanged,,,"FRISI, Antonio Francesco.",unreconciled,,,,Memorie storiche della città di Monza compilate sull' opera del Canonico A. F. F. e continuate dal Prof ... G. Marimonti. [electronic resource],Memorie storiche della città di Monza compilate sull' opera del Canonico A. F. F. e continuate dal Prof ... G. Marimonti.,,"Monza, 1841.",,,"MARIMONTI, Giuseppe.","MARIMONTI, Giuseppe.",single or unclear,,lsidyv35e50d90 -- lsidyv35cb970c,opera,Music
014847400,|||,eng,,,"Henderson, Fred, 1867-1957.",standardised,1867,1957,Fred Henderson,matched,Fred Henderson,Q5495429,,Echoes of the Coming Day: Socialist songs and rhymes. [electronic resource],Echoes of the Coming Day: Socialist songs and rhymes.,,"London : Office of “The Commonweal”, 1887.",,,,,,,lsidyv35f49385,song,Music
014847426,|||,eng,,,"HUMPHREYS, Jennett.",unchanged,,,Jennett Humphreys,matched,Jennett Humphreys,Q14981945,,"Old Welsh Knee Songs, etc. (Second edition.). [electronic resource]","Old Welsh Knee Songs, etc. (Second edition.).",,"Carnarvon : Welsh National Press, 1894.",,,,,,,lsidyv35f48fb9,song,Music
014847479,|||,eng,,,,missing,,,,blank,,,,"Io triumphe! A song of victory on our glorious entry into Cabul; to which is added, the Massacre of Cabul. [By C. J. Cruttwell.] [electronic resource]","Io triumphe! A song of victory on our glorious entry into Cabul; to which is added, the Massacre of Cabul. [By C. J. Cruttwell.]",,"London : William Pickering, 1842.",,,"CRUTTWELL, Charles James.","CRUTTWELL, Charles James.",single or unclear,,lsidyv35c5f0d1,song,Music
014847598,|||,eng,,,"LOGAN, William Hugh.",unchanged,,,"LOGAN, William Hugh.",none,,,,A Pedlar's Pack of Ballads and Songs. With illustrative notes. [electronic resource],A Pedlar's Pack of Ballads and Songs. With illustrative notes.,,"Edinburgh, 1869.",,,,,,,lsidyv35c4cffc,song,Music
014847611,|||,eng,,,"LYNN, Richard A. Neville.",unchanged,,,"LYNN, Richard A. Neville.",none,,,,"Utalie and Tammerlane: The Song of St. Michael's Mount. A recital for musical accompaniment ... Reprinted from E. L. T. Harris-Bickford's Magazine, etc. [electronic resource]","Utalie and Tammerlane: The Song of St. Michael's Mount. A recital for musical accompaniment ... Reprinted from E. L. T. Harris-Bickford's Magazine, etc.",,"Exeter : W. Pollard & Co., 1890.",,,,,,,lsidyv35f49a96,song,Music
014847624,|||,eng,,,"MACKAY, Charles.",unchanged,,,"MACKAY, Charles.",none,,,,Songs for England. The Book of English Songs. [electronic resource],Songs for England. The Book of English Songs.,,"London, [1857.]",,,,,,,lsidyv35c4c718,song,Music
014847629,|||,eng,,,"MACQUOID, Gilbert S.",unchanged,,,"MACQUOID, Gilbert S.",none,,,,"[Jacobite Songs and Ballads ... Edited, with notes ... by G. S. MacQuoid.] [electronic resource]","[Jacobite Songs and Ballads ... Edited, with notes ... by G. S. MacQuoid.]",[Another edition.],"London : W. Scott, 1888.",,,,,,,lsidyv35c434e5,song,Music
014847650,|||,mul,$afre$arus,,"MARINELLI, Giovanni, Professor of Geography at Padua.",unchanged,,,"MARINELLI, Giovanni, Professor of Geography at Padua.",none,,,,"Saggio di cartografia italiana, ossia catalogo ragionato di carte geografiche, piante e prospetti di città, plastici, ecc. riguardanti la regione italiana ne suoi confini geografici e storici. Programma dell'opera.-Schema ed esemplari. [electronic resource]","Saggio di cartografia italiana, ossia catalogo ragionato di carte geografiche, piante e prospetti di città, plastici, ecc. riguardanti la regione italiana ne suoi confini geografici e storici. Programma dell'opera.-Schema ed esemplari.",,"Firenze, 1894.",,,,,,,lsidyv35f483ec,opera,Music
014847663,|||,ita,,,"MARZARI-PENCATI, Giuseppe, Count.",unchanged,,,"MARZARI-PENCATI, Giuseppe, Count.",none,,,,"Corsa pel Bacino del Rodano e per la Liguria d'Occidente divisa in sei sezioni, di cui la principale, cioè quella che diede motivo all'opera contiene la Orittografia del Monte Coiron, etc. [electronic resource]","Corsa pel Bacino del Rodano e per la Liguria d'Occidente divisa in sei sezioni, di cui la principale, cioè quella che diede motivo all'opera contiene la Orittografia del Monte Coiron, etc.",,"Vicenza, 1806.",,,,,,,lsidyv35c02c75,opera,Music
014847664,|||,ita,,,"MASINI, Antonio.",unchanged,,,"MASINI, Antonio.",none,,,,"[Bologna perlustrata. Terza impressione. accrescuita, in cui si fà mentione ogni giorno in perpetuo delle fontioni sacre e profane di tutto l'anno. Delle chiese e loro fondationi, de'Santi e d'altri Bolognesi morti in opinione di santità; ... de'pittori, scultori, ... che hanno operato in Bologna, delle donne illustri nelle lettere, etc.] [electronic resource]","[Bologna perlustrata. Terza impressione. accrescuita, in cui si fà mentione ogni giorno in perpetuo delle fontioni sacre e profane di tutto l'anno. Delle chiese e loro fondationi, de'Santi e d'altri Bolognesi morti in opinione di santità; ... de'pittori, scultori, ... che hanno operato in Bologna, delle donne illustri nelle lettere, etc.]",[Another edition.] Ampliata e ricorretta. [Edited by D. L. A. S.],"Bologna, 1823-26.",,,"S., D. L. A.","S., D. L. A.",single or unclear,,lsidyv36035e23 -- lsidyv3da0adb9,opera,Music
014847673,|||,lat,,,"Mela, Pomponius.",unchanged,,,Pomponius Mela,matched,Pomponius Mela,Q297515,,"Pomponii Melæ de situ orbis libri tres; ad omnium Angliæ et Hiberniæ Codicum MSS. fidem ... recogniti et collati; tabulisque ... illustrati. Opera et studio J. Reinoldii ... Editio altera, emendata. [electronic resource]","Pomponii Melæ de situ orbis libri tres; ad omnium Angliæ et Hiberniæ Codicum MSS. fidem ... recogniti et collati; tabulisque ... illustrati. Opera et studio J. Reinoldii ... Editio altera, emendata.",,"Etonæ, 1820.",,,"Reynolds, John, 1671-1758.","Reynolds, John, 1671-1758.",single or unclear,,lsidyv35d01fd6,opera,Music
014847679,|||,ita,,,"Mercuri, Filippo.",unchanged,,,Filippo Mercuri,matched,Filippo Mercuri,Q97066297,,"La vera località di Curi in Sabina, antichissima città esistente nel territorio della Fara: discoperte nel romitorio di S. Maria dell'arci dimostrata con documenti. [electronic resource]","La vera località di Curi in Sabina, antichissima città esistente nel territorio della Fara: discoperte nel romitorio di S. Maria dell'arci dimostrata con documenti.",,"Roma, 1838.",,,,,,,lsidyv35e98e3a,opera,Music
014847680,|||,eng,,,"Meredith, George, 1828-1909",standardised,1828,1909,George Meredith,matched,George Meredith,Q90238,,Odes in contribution to the Song of French History. [electronic resource],Odes in contribution to the Song of French History.,,"London : Archibald Constable & Co., 1898.",,,,,,,lsidyv35c6d236,song,Music
014847726,|||,ita,,,"MOSCHINI, Giovanni Antonio.",unchanged,,,Giannantonio Moschini,matched,Giannantonio Moschini,Q5558181,,La Chiesa e il Seminario di Sta Maria della salute in Venezia descritti da G. M. ... Opera postuma con aggiunte [and a life of the author by G. C. Parolare]. [electronic resource],La Chiesa e il Seminario di Sta Maria della salute in Venezia descritti da G. M. ... Opera postuma con aggiunte [and a life of the author by G. C. Parolare].,,"Venezia, 1842.",,,,,,,lsidyv35e1a3fb,opera,Music
014847735,|||,ita,,,"De Muro, Vincenzo.",unchanged,,,"De Muro, Vincenzo.",none,,,,"Ricerche storiche e critiche sulla origine, le vicende, e la rovina di Atella antica città della Campania. Opera postuma. Prima edizione. [Edited by D. de Muro.] [electronic resource]","Ricerche storiche e critiche sulla origine, le vicende, e la rovina di Atella antica città della Campania. Opera postuma. Prima edizione. [Edited by D. de Muro.]",,"Napoli, 1840.",,,"MURO, Domenico de.","MURO, Domenico de.",single or unclear,,lsidyv35e980f6,opera,Music
