Aleph system no.,Country code,Language code (008),Language code (041),DDC,Personal author,Author_review_status,Author_birth_year,Author_death_year,Author_name_clean,Author_reconciliation_status,Author_Wikidata_label,Author_Wikidata_QID,Corporate author,Title,Title_clean,Edition,Imprint,Series,Subjects,Other personal authors,Other_personal_authors_clean,Other_authors_structure,Other corporate authors,DOM ID,Type,Genre
014814632,|||,und,,,"JOHNSON, Charles, Dramatic Writer.",unchanged,,,"JOHNSON, Charles, Dramatic Writer.",none,,,,"The Village Opera [in three acts, in prose; with songs] ... To which is added the musick to each song. [electronic resource]","The Village Opera [in three acts, in prose; with songs] ... To which is added the musick to each song.",,"London, 1729.",,,,,,,lsidyv3ab88961,opera,Music
014814671,|||,eng,,,"JOHNSTON, Arthur.",unchanged,,,"JOHNSTON, Arthur.",none,,,,"Narrative of the operations of a detachment in an expedition to Candy, in the island of Ceylon, in ... 1804, etc. [electronic resource]","Narrative of the operations of a detachment in an expedition to Candy, in the island of Ceylon, in ... 1804, etc.",,"London, 1810.",,,,,,,lsidyv30ae160c,opera,Music
014814679,|||,und,,,"Johnston, John, M.D.",unchanged,,,"Johnston, John, M.D.",none,,,,Musa Medica: a sheaf of song and verse. [electronic resource],Musa Medica: a sheaf of song and verse.,,"London : Savoy Press, 1897.",,,,,,,lsidyv347228e5,song,Music
014814754,|||,und,,,"Jones, William, Sir, 1746-1794.",standardised,1746,1794,William Jones,matched,William Jones,Q273969,,"The Hindu Wife and the Hymns by Sir W. J. ... Second edition, etc. [electronic resource]","The Hindu Wife and the Hymns by Sir W. J. ... Second edition, etc.",,"Calcutta : J. Ghose, 1881.",,,,,,,lsidyv34750435,hymn,Music
014814845,|||,und,,,"KEANE, Henry, Novelist.",unchanged,,,"KEANE, Henry, Novelist.",unreconciled,,,,The Faded Poppy. A fragment of Philistine melodrama. [A novel.] [electronic resource],The Faded Poppy. A fragment of Philistine melodrama. [A novel.],,"London : Hodder Bros., 1895.",,,,,,,lsidyv3a52e16d,melody,Music
014814859,|||,eng,,,"KEASLEY, George.",unchanged,,,"KEASLEY, George.",none,,,,The Rev. George Keasley's Second Letter to the Editor of the “Yorkshire Gazette” [on the question of Popery]. [electronic resource],The Rev. George Keasley's Second Letter to the Editor of the “Yorkshire Gazette” [on the question of Popery].,,"Leeds : T. E. Bradley, 1851.",,,,,,,lsidyv3014f623,opera,Music
014814874,|||,und,,,"Keble, John, 1792-1866",standardised,1792,1866,John Keble,matched,John Keble,Q955187,,"Keble's Evening Hymn [from the “Christian Year”], illustrated by E. Waring. [electronic resource]","Keble's Evening Hymn [from the “Christian Year”], illustrated by E. Waring.",,"London, [1865.]",,,"Keble, John, 1792-1866 -- WARING, Eleanor.","Keble, John, 1792-1866 -- WARING, Eleanor.",multiple: dash,,lsidyv3a991532,hymn,Music
014814976,|||,und,,,"Kenney, James.",unchanged,,,"Kenney, James.",none,,,,"[False Alarms; or, My Cousin, a comic opera in three acts [in prose, with songs].] [electronic resource]","[False Alarms; or, My Cousin, a comic opera in three acts [in prose, with songs].]",Second edition.,"London, 1807.",,,,,,,lsidyv3a58122d,opera,Music
014815056,|||,eng,,,"Kidd, John, 1775-1851.",standardised,1775,1851,John Kidd,matched,John Kidd,Q723419,,"A geological essay on the imperfect evidence in support of a theory of the Earth, deducible either from its general structure or from the changes produced on its surface by the operation of existing causes. [electronic resource]","A geological essay on the imperfect evidence in support of a theory of the Earth, deducible either from its general structure or from the changes produced on its surface by the operation of existing causes.",,"Oxford, 1815.",,,,,,,lsidyv3c80356b,opera,Music
014815069,|||,und,,,,missing,,,,blank,,,,"The King's Highway, daily texts & hymns for a month. Illustrated by F. Hines. [electronic resource]","The King's Highway, daily texts & hymns for a month. Illustrated by F. Hines.",,"London; Nuremberg [printed : E. Nister, 1890].",,,,,,,lsidyv3944950e,hymn,Music
014815079,|||,und,,,"KING, Charles, General.",unchanged,,,Charles King,matched,Charles King,Q76167791,,Trooper Ross and Vignal Butte. [A tale.] [electronic resource],Trooper Ross and Vignal Butte. [A tale.],,"London; Philadelphia printed : J. B. Lippincott Co., 1896.",,,,,,,lsidyv3a0650ee,opera,Music
014815184,|||,und,,,"KINROSS, Albert.",unchanged,,,Albert Kinross,matched,Albert Kinross,Q4710640,,An Opera and Lady Grasmere. [electronic resource],An Opera and Lady Grasmere.,,"Bristol : J. W. Arrowsmith, [1899.].",,,,,,,lsidyv39faf6e4,opera,Music
014815356,|||,und,,,"La Brète, Jean de, 1854-1945.",standardised,1854,1945,Jean de La Brète,matched,Jean de La Brète,Q3175471,,[Un Vaincu.] Fate's Fetters ... Translated by Mrs. F. Hoper-Dixon. [electronic resource],[Un Vaincu.] Fate's Fetters ... Translated by Mrs. F. Hoper-Dixon.,,"London : Digby, Long & Co., [1897.].",,,"DIXON, F. Hoper, Mrs.","DIXON, F. Hoper, Mrs.",single or unclear,,lsidyv39df5778,opera,Music
014815385,|||,und,,,,missing,,,,blank,,,,"The Peruvian, a comic opera, in three acts [in prose, with songs] ... By a Lady, etc. [electronic resource]","The Peruvian, a comic opera, in three acts [in prose, with songs] ... By a Lady, etc.",,"London, 1786.",,,,,,,lsidyv3a52575c,opera,Music
014815638,|||,und,,,"LAYCOCK, Samuel.",unchanged,,,"LAYCOCK, Samuel.",unreconciled,,,,Warblin's fro' an Owd Songster. With an introductory sketch by W. Trevor. [Illustrated.] [electronic resource],Warblin's fro' an Owd Songster. With an introductory sketch by W. Trevor. [Illustrated.],,"pp. xv. 376. W. E. Clegg: Oldham, 1893.",,,"TREVOR, William, of Manchester.","TREVOR, William, of Manchester.",single or unclear,,lsidyv352bfe15,song,Music
014815641,|||,und,,,"LAZARUS, Emma.",unchanged,,,"LAZARUS, Emma.",none,,,,"Songs of a Semite: The Dance to Death, and other poems. [electronic resource]","Songs of a Semite: The Dance to Death, and other poems.",,"New York : Office of “The American Hebrew”, 1882.",,,,,,,lsidyv39f15f55,song,Music
014815666,|||,eng,,,"LEBASTEUR, H., Engineer.",unchanged,,,"LEBASTEUR, H., Engineer.",none,,,,"The Metals at the Paris International Exhibition of 1878: their resisting properties, and their uses in railway plant. [electronic resource]","The Metals at the Paris International Exhibition of 1878: their resisting properties, and their uses in railway plant.",,"London ; Paris [printed], 1880.",,,,,,,lsidyv3cb63fb0,opera,Music
014815843,|||,und,,,"LEONARD, Henry Charles.",unchanged,,,"LEONARD, Henry Charles.",none,,,,Sacred Songs of the World. Translated from one hundred and twenty languages. Edited by H. C. Leonard. [electronic resource],Sacred Songs of the World. Translated from one hundred and twenty languages. Edited by H. C. Leonard.,,"London : Elliot Stock, 1899.",,,,,,,lsidyv3392aa4b,song,Music
014815884,|||,und,,,"Leterrier, Eugène.",unchanged,,,Eugène Leterrier,matched,Eugène Leterrier,Q3059998,,"A Comic Opera ... entitled: The Lucky Star. Founded on and adapted from the French original ... Revised ... by H. L. [i.e. Mrs. D'Oyly Carte], etc. [electronic resource]","A Comic Opera ... entitled: The Lucky Star. Founded on and adapted from the French original ... Revised ... by H. L. [i.e. Mrs. D'Oyly Carte], etc.",,"London : Chappell & Co., [1899.].",,,"Carte, Helen D'Oyly, 1852-1913. -- Vanloo, Albert, 1846-1920.","Carte, Helen D'Oyly, 1852-1913. -- Vanloo, Albert, 1846-1920.",multiple: dash,,lsidyv34ec785a,opera,Music
014815889,|||,eng,,,,missing,,,,blank,,,,"Letters to the Christian Church, at Bradford, on the controversy concerning Popery, written during the winter of 1828-29. [electronic resource]","Letters to the Christian Church, at Bradford, on the controversy concerning Popery, written during the winter of 1828-29.",,"Bradford : T. Inkersley & Co., 1829.",,,,,,,lsidyv3bd59f66,opera,Music
014816175,enk,eng,,,,missing,,,,blank,,,,"Rump [electronic resource] ; or An Exact collection of the choycest poems and songs relating to the late times. By the most eminent wits, from anno 1639. to anno 1661.","Rump [electronic resource] ; or An Exact collection of the choycest poems and songs relating to the late times. By the most eminent wits, from anno 1639. to anno 1661.",,"London, Printed for Henry Brome at the Gun in Ivy-lane, and Henry Marsh at the Princes Armes in Chancery-lane. 1662. [Reprinted 1874]",,"Puritans. -- Political ballads and songs, English. -- Great Britain History",,,,,lsidyv3070c6d7,song,Music
014816190,|||,und,,,"ADAMS, Estelle Davenport.",unchanged,,,Caroline Estelle Koerner Adams,matched,Caroline Estelle Koerner Adams,Q135431367,,"Sea Song and River Rhyme from Chaucer to Tennyson, selected and edited by E. D. Adams. With a new poem by A. C. Swinburne, etc. [electronic resource]","Sea Song and River Rhyme from Chaucer to Tennyson, selected and edited by E. D. Adams. With a new poem by A. C. Swinburne, etc.",,"London : G. Redway, 1887.",,,,,,,lsidyv33514a94,song,Music
014816202,|||,und,,,"Dibdin, Charles, 1745-1814.",standardised,1745,1814,Charles Dibdin,matched,Charles Dibdin,Q1064116,,"The Shepherdess of the Alps: a comic opera, in three acts, etc. [By Charles Dibdin. Based on “La Bergère des Alpes” of Jean François Marmontel.] [electronic resource]","The Shepherdess of the Alps: a comic opera, in three acts, etc. [By Charles Dibdin. Based on “La Bergère des Alpes” of Jean François Marmontel.]",,"London : G. Kearsley, 1780.",,,"Marmontel, Jean-François, 1723-1799.","Marmontel, Jean-François, 1723-1799.",single or unclear,,lsidyv32c4138c,opera,Music
014816207,|||,und,,,,missing,,,,blank,,,,"The Festival of Anacreon, containing a collection of modern songs written for the Anacreontic Society, the Beef-Steak and Humbug Clubs; by Captain Morris, Mr. Hewerdine, Sir John Moore, and other lyric writers ... (Third part.) The eighth edition. [electronic resource]","The Festival of Anacreon, containing a collection of modern songs written for the Anacreontic Society, the Beef-Steak and Humbug Clubs; by Captain Morris, Mr. Hewerdine, Sir John Moore, and other lyric writers ... (Third part.) The eighth edition.",,"London : W. Holland, [1810?].",,,,,,,lsidyv30661257,song,Music
014816215,|||,und,,,"ANKETELL, John, Curate of Donaghendry.",unchanged,,,"ANKETELL, John, Curate of Donaghendry.",none,,,,"Poems on Several Subjects ... To which are added, The Epistle of Yarico to Inkle; and the English and Latin songs of Chevy Chase. [electronic resource]","Poems on Several Subjects ... To which are added, The Epistle of Yarico to Inkle; and the English and Latin songs of Chevy Chase.",,"Dublin : Printed for the Author, 1793.",,,,,,,lsidyv338c5d73,song,Music
014816229,|||,und,,,,missing,,,,blank,,,,"The Ballads and Songs of Ayrshire, illustrated with sketches, historical, traditional, narrative, and biographical. [electronic resource]","The Ballads and Songs of Ayrshire, illustrated with sketches, historical, traditional, narrative, and biographical.",,"Ayr; T. G. Stevenson Edinburgh : 2 ser. Published for the Editor, 1846, 47.",,,,,,,lsidyv32b5bdb7,song,Music
014816234,|||,und,,,"B., E. F.",unchanged,,,"B., E. F.",none,,,,Songs of Eternal Life. Translated from the German (by E. F. B.) With illustrations. [electronic resource],Songs of Eternal Life. Translated from the German (by E. F. B.) With illustrations.,,"London : Seeley, Jackson, & Halliday, 1858.",,,"BEVAN, Emma Frances.","BEVAN, Emma Frances.",single or unclear,,lsidyv3386c11f,song,Music
014816244,|||,und,,,"BARKER, Lucy D. Sale.",unchanged,,,"BARKER, Lucy D. Sale.",none,,,,Illustrated Poems and Songs for Young People. Edited by Mrs. Sale Barker. [electronic resource],Illustrated Poems and Songs for Young People. Edited by Mrs. Sale Barker.,,"London : G. Routledge & Sons, 1885 [1884].",,,,,,,lsidyv32c1f854,song,Music
014816276,|||,und,,,"BELL, Robert, Author of “The Life of Canning.”.",unchanged,,,"BELL, Robert, Author of “The Life of Canning.”.",none,,,,[Art and Song. A series of original ... engravings from masterpieces of art of the nineteenth century accompanied by a selection of the choicest poems in the English language. Edited by R. Bell.] [electronic resource],[Art and Song. A series of original ... engravings from masterpieces of art of the nineteenth century accompanied by a selection of the choicest poems in the English language. Edited by R. Bell.],New edition.,"London : J. S. Virtue & Co., [1892.].",,,,,,,lsidyv32b6ae32,song,Music
014816283,|||,und,,,"BENNETT, William Cox.",unchanged,,,William Cox Bennett,matched,William Cox Bennett,Q8007212,,"The Lark: songs, ballads and recitations for the people. [electronic resource]","The Lark: songs, ballads and recitations for the people.",,"London : Hart & Co., [1885.].",,,,,,,lsidyv31a39bc8,song,Music
014816307,enk,eng,,,"BLOOMFIELD, Robert, Poet.",unchanged,,,"BLOOMFIELD, Robert, Poet.",none,,,,"Rural tales, ballads, and songs. [electronic resource]","Rural tales, ballads, and songs.",,"printed for Vernor & Hood; and Longman & Rees; by T. Bensley : London, 1802.",,,"Lofft, Capel, 1751-1824. -- NESBIT, Charlton. -- THURSTON, John, Artist.","Lofft, Capel, 1751-1824. -- NESBIT, Charlton. -- THURSTON, John, Artist.",multiple: dash,,lsidyv2eb8096b,song,Music
014816318,|||,und,,,"BOURNE, Thomas, Vicar of Stoke Golding and Dadlington.",unchanged,,,"BOURNE, Thomas, Vicar of Stoke Golding and Dadlington.",none,,,,"The Maid of Skiddaw, Songs of Palestine, and other poems. [electronic resource]","The Maid of Skiddaw, Songs of Palestine, and other poems.",,"Turnham Green : The Author, 1836.",,,,,,,lsidyv2eba7e03,song,Music
014816343,|||,und,,,"Brown, James, freemason.",unchanged,,,"Brown, James, freemason.",none,,,,"Odes, Elegies, Songs, &c. [electronic resource]","Odes, Elegies, Songs, &c.",,"Bristol : G. Routh, 1786.",,,,,,,lsidyv33877ce0,song,Music
014816353,|||,und,,,"BRUCE, George, Miniature Painter.",unchanged,,,"BRUCE, George, Miniature Painter.",none,,,,"Poems, Ballads, and Songs, on various occassions. [electronic resource]","Poems, Ballads, and Songs, on various occassions.",,"Edinburgh : -215. Oliver & Boyd, 1813.",,,,,,,lsidyv3028c843,song,Music
014816370,|||,und,,,"Burns, Robert, 1759-1796",standardised,1759,1796,Robert Burns,matched,Robert Burns,Q81960,,"The National Burns. Edited by Rev. George Gilfillan, including the airs of all the songs, and an original life of Burns by the editor. [With plates, including portraits.] [electronic resource]","The National Burns. Edited by Rev. George Gilfillan, including the airs of all the songs, and an original life of Burns by the editor. [With plates, including portraits.]",,"Glasgow : William Mackenzie, [1879, 80.].",,,"Gilfillan, George, 1813-1878.","Gilfillan, George, 1813-1878.",single or unclear,,lsidyv3832f08e -- lsidyv3026795e,song,Music
014816376,|||,und,,,"Burns, Robert, 1759-1796",standardised,1759,1796,Robert Burns,matched,Robert Burns,Q81960,,"Poems & Songs by Robert Burns. With original illustrations by R. Herdman, etc. (The “Edina” edition.). [electronic resource]","Poems & Songs by Robert Burns. With original illustrations by R. Herdman, etc. (The “Edina” edition.).",,"Edinburgh : W. P. Nimmo, Hay & Mitchell, [1893.].",,,,,,,lsidyv32b70ded,song,Music
014816378,|||,und,,,"Burns, Robert, 1759-1796",standardised,1759,1796,Robert Burns,matched,Robert Burns,Q81960,,"The Poems and Songs of Robert Burns. Edited with introduction, notes and glossary by Andrew Lang, assisted by W. A. Craigie. With a portrait. [electronic resource]","The Poems and Songs of Robert Burns. Edited with introduction, notes and glossary by Andrew Lang, assisted by W. A. Craigie. With a portrait.",,"London : Methuen & Co., 1896.",,,"Craigie, William A. (William Alexander), Sir, 1867-1957 -- Lang, Andrew, 1844-1912","Craigie, William A. (William Alexander), Sir, 1867-1957 -- Lang, Andrew, 1844-1912",multiple: dash,,lsidyv3387287d,song,Music
014816436,|||,und,,,"C*****, W., Rector of K**** W****.",unchanged,,,"C*****, W., Rector of K**** W****.",unreconciled,,,,"A Caveat to the Will of a certain Northern Vicar. Addressed to the Reverend W. C*****, Rector of K**** W**** [i.e William Cooper, Rector of Kirby Wiske]. [In verse.] [electronic resource]","A Caveat to the Will of a certain Northern Vicar. Addressed to the Reverend W. C*****, Rector of K**** W**** [i.e William Cooper, Rector of Kirby Wiske]. [In verse.]",,"London : W. Flexney, 1766.",,,,,,,lsidyv2ebcc4c4,opera,Music
014816472,|||,und,,,"CHADWICK, Sheldon.",unchanged,,,"CHADWICK, Sheldon.",none,,,,"Working and Singing: poems, lyrics, and songs on the life-march. [electronic resource]","Working and Singing: poems, lyrics, and songs on the life-march.",,"London : Edwin Benson, 1895.",,,,,,,lsidyv31720eab,song,Music
014816482,|||,und,,,,missing,,,,blank,,,,"Complete Repertoire of the Songs, Ballads, and Plantation Melodies, sung by the ... Christy Minstrels ... The three hundred and fourth thousand, etc. [electronic resource]","Complete Repertoire of the Songs, Ballads, and Plantation Melodies, sung by the ... Christy Minstrels ... The three hundred and fourth thousand, etc.",,"London : Hopwood & Crew, [1870?].",,,,,,,lsidyv2eb153bc,melody,Music
014816503,|||,und,,,,missing,,,,blank,,,,"A collection of odes, songs, and epigrams, against the Whigs, alias the blue and buff; in which are included. Mr. Hewerdine's political songs. [electronic resource]","A collection of odes, songs, and epigrams, against the Whigs, alias the blue and buff; in which are included. Mr. Hewerdine's political songs.",,"J. Bell : London, 1790.",,,"HEWERDINE, Song Writer.","HEWERDINE, Song Writer.",single or unclear,,lsidyv32b5a92f,song,Music
014816507,|||,und,,,,missing,,,,blank,,,,"The fourth - and last - collection of poems, satyrs, songs &c. [electronic resource]","The fourth - and last - collection of poems, satyrs, songs &c.",,"London, 1689.",,,,,,,lsidyv2eb48038,song,Music
014816512,|||,und,,,"COLMAN, George, the Younger.",unchanged,,,George Colman the Younger,matched,George Colman the Younger,Q513170,,[Inkle and Yarico: an opera; in three acts; as performed at the Theatres-Royal in Covent-Garden and the Hay-market ... A new edition.] [electronic resource],[Inkle and Yarico: an opera; in three acts; as performed at the Theatres-Royal in Covent-Garden and the Hay-market ... A new edition.],A new edition.,"London : G. G. J. & J. Robinson, 1792.",,,,,,,lsidyv3351d9ce,opera,Music
014816522,|||,und,,,,missing,,,,blank,,,,"The Complaint: or, Night-thoughts on life, death, & immortality. (Night the fourth. The Christian Triumph. Containing our only cure for the fear of death, and proper sentiments of heart on that inestimable blessing, etc.) [By Edward Young.] [electronic resource]","The Complaint: or, Night-thoughts on life, death, & immortality. (Night the fourth. The Christian Triumph. Containing our only cure for the fear of death, and proper sentiments of heart on that inestimable blessing, etc.) [By Edward Young.]",,"London : Printed for R. Dodsley; sold by M. Cooper, 1743.",,,"YOUNG, Edward, the Poet.","YOUNG, Edward, the Poet.",single or unclear,,lsidyv30a3b8bb,opera,Music
014816603,|||,und,,,,missing,,,,blank,,,,"[The Cupid. A collection of love songs, in twelve parts. Suited to twelve different sorts of lovers, etc. [With plates.]] [electronic resource]","[The Cupid. A collection of love songs, in twelve parts. Suited to twelve different sorts of lovers, etc. [With plates.]]",[Another edition.] Reprinted from the first edition.,"Derby : Privately printed, 1891.",,,,,,,lsidyv32b5b8e6,song,Music
014816607,|||,und,,,"D., N.",unchanged,,,"D., N.",none,,,,"[An Antidote against Melancholy: made up in pills. Compounded of witty ballads, jovial songs, and merry catches. [The address to the reader signed: N. D.]] [electronic resource]","[An Antidote against Melancholy: made up in pills. Compounded of witty ballads, jovial songs, and merry catches. [The address to the reader signed: N. D.]]","[Another edition.] [The editor's introduction signed: J. P. C., i.e. John Payne Collier.]","[London, 1870.]",,,"C., J. P. -- Collier, John Payne, 1789-1883","C., J. P. -- Collier, John Payne, 1789-1883",multiple: dash,,lsidyv32b88443,song,Music
014816623,|||,und,,,"DELEHANTY, William H.",unchanged,,,William H. Delehanty,matched,William H. Delehanty,Q134488440,,American Songs & Jokes containing sketches of American life ... Real wit from the plantation. [electronic resource],American Songs & Jokes containing sketches of American life ... Real wit from the plantation.,,"London : Diprose & Bateman, [1877.].",,,,,,,lsidyv338b1cad,song,Music
014816634,|||,und,,,"Dibdin, Thomas, 1771-1841.",standardised,1771,1841,Thomas John Dibdin,matched,Thomas John Dibdin,Q683268,,"The cabinet: a comic opera, in three acts, etc. [electronic resource]","The cabinet: a comic opera, in three acts, etc.",,"London : Longman, Hurst, Rees & Orme, 1805.",,,,,,,lsidyv335289ae,opera,Music
014816642,|||,und,,,"Diprose, John.",unchanged,,,John Diprose,matched,John Diprose,Q114045777,,New Standard Song Book and Reciter ... An entirely new compilation from the works of the ... best ... Authors ... Compiled by J. D. [electronic resource],New Standard Song Book and Reciter ... An entirely new compilation from the works of the ... best ... Authors ... Compiled by J. D.,,"London, [1877.]",,,,,,,lsidyv35c595dc -- lsidyv306fd341,song,Music
014816658,|||,und,,,"Dryden, John, 1631-1700.",standardised,1631,1700,John Dryden,matched,John Dryden,Q213355,,"Ode de Dryden para o dia de Santa Cecilia. Traduzida em portugues. [With “Ode de Gray sobre o progreço da poezia”, “Hymno de Gray a adversidade”, and “Ode de Gray vendo ao longe o Colegio de Eton”. The translator named in the foreword as Antonio de Araujo.] [electronic resource]","Ode de Dryden para o dia de Santa Cecilia. Traduzida em portugues. [With “Ode de Gray sobre o progreço da poezia”, “Hymno de Gray a adversidade”, and “Ode de Gray vendo ao longe o Colegio de Eton”. The translator named in the foreword as Antonio de Araujo.]",,[1799].,,,"ARAUJO DE AZEVÉDO, Antonio de, Count da Barca.","ARAUJO DE AZEVÉDO, Antonio de, Count da Barca.",single or unclear,,lsidyv2eb15130,hymn,Music
014816669,|||,und,,,"D'Urfey, Thomas, 1653-1723.",standardised,1653,1723,Thomas d'Urfey,matched,Thomas d'Urfey,Q2145838,,"A Fool's Preferment; or, The three Dukes of Dunstable. A comedy [in five acts and in prose.] Together with the Songs and notes to 'em, ... composed by H. Purcell. [electronic resource]","A Fool's Preferment; or, The three Dukes of Dunstable. A comedy [in five acts and in prose.] Together with the Songs and notes to 'em, ... composed by H. Purcell.",,"London, 1688.",,,,,,,lsidyv33531463,song,Music
014816674,|||,und,,,,missing,,,,blank,,,Edinburgh Angling Club (EDINBURGH),Songs of the Edinburgh Angling Club. With illustrations ... by members of the Club. [electronic resource],Songs of the Edinburgh Angling Club. With illustrations ... by members of the Club.,,"Edinburgh : Privately printed, 1858.",,,,,,,lsidyv30337870,song,Music
014816702,|||,und,,,,missing,,,,blank,,,,[A Collection of Fenian Songs.] [electronic resource],[A Collection of Fenian Songs.],,"New York : H. De Marsan, [1865?].",,,,,,,lsidyv33505ee8,song,Music
014816725,|||,und,,,"FORD, Robert, Author of Thistledown, etc.",unchanged,,,"FORD, Robert, Author of Thistledown, etc.",none,,,,"The Harp of Perthshire. A collection of songs, ballads ... chiefly by local authors, with notes ... by R. Ford. [electronic resource]","The Harp of Perthshire. A collection of songs, ballads ... chiefly by local authors, with notes ... by R. Ford.",,"Paisley : A. Gardner, 1893.",,,,,,,lsidyv30309e01,song,Music
014816726,|||,und,,,"FORD, Robert, Author of Thistledown, etc.",unchanged,,,"FORD, Robert, Author of Thistledown, etc.",none,,,,"Vagabond Songs and Ballads of Scotland. With many old and familiar melodies. Edited, with notes, by R. Ford. [electronic resource]","Vagabond Songs and Ballads of Scotland. With many old and familiar melodies. Edited, with notes, by R. Ford.",,"Paisley : A. Gardner, 1899.",,,,,,,lsidyv313ea658,melody,Music
014816727,|||,und,,,"FORSTER, Thomas, F.L.S.",unchanged,,,"FORSTER, Thomas, F.L.S.",none,,,,"[The Piper's Wallet supplied with the harmony of the Muses, in a collection of original Scottish and English Songs composed by two literary gentlemen (T. F. and R. Norie [and others]).] [electronic resource]","[The Piper's Wallet supplied with the harmony of the Muses, in a collection of original Scottish and English Songs composed by two literary gentlemen (T. F. and R. Norie [and others]).]",Third edition.,"Bruges, 1847.",,,,,,,lsidyv2eb31dfc -- lsidyv335a5624,song,Music
014816735,|||,und,,,Freemasons.,unchanged,,,Freemasons.,none,,,,"The Generous Freemason; or, the Constant Lady. With the humours of Squire Noodle, and his man Doodle. A tragi-comi-farcical ballad opera. In three acts [and in prose and verse]. With the music prefix'd to each song. By the author of the Lover's Opera [W. R. Chetwood]. [electronic resource]","The Generous Freemason; or, the Constant Lady. With the humours of Squire Noodle, and his man Doodle. A tragi-comi-farcical ballad opera. In three acts [and in prose and verse]. With the music prefix'd to each song. By the author of the Lover's Opera [W. R. Chetwood].",,"London, 1731.",,,"CHETWOOD, William Rufus.","CHETWOOD, William Rufus.",single or unclear,,lsidyv3359b4b9,opera,Music
014816752,|||,und,,,"Scott-Gatty, Alfred, 1847-1918.",standardised,1847,1918,Alfred Scott-Gatty,matched,Alfred Scott-Gatty,Q2645894,,Aunt Judy's Song-Book for Children. [electronic resource],Aunt Judy's Song-Book for Children.,,"London : Bell & Daldy, 1871.",,,,,,,lsidyv313f05dc,song,Music
