Aleph system no.,Country code,Language code (008),Language code (041),DDC,Personal author,Author_review_status,Author_birth_year,Author_death_year,Author_name_clean,Author_reconciliation_status,Author_Wikidata_label,Author_Wikidata_QID,Corporate author,Title,Title_clean,Edition,Imprint,Series,Subjects,Other personal authors,Other_personal_authors_clean,Other_authors_structure,Other corporate authors,DOM ID,Type,Genre
014602842,|||,und,,,,missing,,,,blank,,,,"Songs for Christmas and the New Year, by Lucy A. Bennett, Rev. Richard Wilton [and others], etc. [electronic resource]","Songs for Christmas and the New Year, by Lucy A. Bennett, Rev. Richard Wilton [and others], etc.",,"London : Castell Bros., [1886.].",,,,,,,lsidyv2eb1ad90,song,Music
014602846,|||,und,,,"CURTIS, Walter.",unchanged,,,Walter Septimus Curtis,matched,Walter Septimus Curtis,Q109657334,,"Book of Word & Music of Humorous Songs, Burlesque Sketches, & Recitals. [With a portrait.] [electronic resource]","Book of Word & Music of Humorous Songs, Burlesque Sketches, & Recitals. [With a portrait.]",,"Leeds : Nutt & Co., [1896.].",,,,,,,lsidyv2eb1a6ef,song,Music
014602856,|||,und,,,"Henley, William Ernest, 1849-1903.",standardised,1849,1903,William Ernest Henley,matched,William Ernest Henley,Q552617,,Hawthorn and Lavender: songs and madrigals. [electronic resource],Hawthorn and Lavender: songs and madrigals.,,"London : [W. Heinemann, 1899.].",,,,,,,lsidyv2eb1ac4d,song,Music
014602859,|||,und,,,"INCLEDON, Benjamin Charles.",unchanged,,,Charles Incledon,matched,Charles Incledon,Q4201127,,"Variety: containing original and selected songs in the favourite entertainment now performing by C. I. of Covent Garden Theatre, etc. [electronic resource]","Variety: containing original and selected songs in the favourite entertainment now performing by C. I. of Covent Garden Theatre, etc.",,"London, [1805?]",,,,,,,lsidyv2eb1d7fe,song,Music
014602860,|||,und,,,"INCLEDON, Benjamin Charles.",unchanged,,,Charles Incledon,matched,Charles Incledon,Q4201127,,"The Wandering Melodist: or, The Rose, the thistle, and the Shamrock: consisting of fifteen songs, sung by Mr. I., etc. [electronic resource]","The Wandering Melodist: or, The Rose, the thistle, and the Shamrock: consisting of fifteen songs, sung by Mr. I., etc.",,"London, [1805?]",,,,,,,lsidyv2eb1d8a3,melody,Music
014602881,|||,und,,,,missing,,,,blank,,,,A Working-Man's Song [beginning “The Working-Man has many friends”]. [electronic resource],A Working-Man's Song [beginning “The Working-Man has many friends”].,,"Birmingham : White & Pike, [1885?].",,,,,,,lsidyv2eb1c37c,song,Music
014602912,|||,und,,,"JAMES, Catherine A.",unchanged,,,"JAMES, Catherine A.",none,,,,Teacher Li: a missionary reading ... Arranged as a service of song. [electronic resource],Teacher Li: a missionary reading ... Arranged as a service of song.,,"London : Church Missionary Society, [1898.].",,,,,,,lsidyv2eb22a4b,song,Music
014602914,|||,und,,,"KENNEDY, David, Vocalist, the Elder.",unchanged,,,"KENNEDY, David, Vocalist, the Elder.",none,,,,Book of words of Mr. Kennedy's Entertainment on the songs of Scotland. [electronic resource],Book of words of Mr. Kennedy's Entertainment on the songs of Scotland.,,"London, 1866.",,,,,,,lsidyv2eb1dd3e,song,Music
014602922,|||,und,,,"ROSS, John Wilson.",unchanged,,,John Wilson Ross,matched,John Wilson Ross,Q18810883,,"Fact and Fancy. An ode for the jubilee of the Queen's reign. Also The University Boat Race, a song. [electronic resource]","Fact and Fancy. An ode for the jubilee of the Queen's reign. Also The University Boat Race, a song.",,"London : Diprose & Bateman, 1886.",,,,,,,lsidyv2eb1e424,song,Music
014602959,|||,und,,,,missing,,,,blank,,,,"Songs, Chorusses, etc., in the new pantomime of Harlequin Tour; or, the Dominion of Fancy, as performed at the Theatre Royal, Covent-Garden, etc. [electronic resource]","Songs, Chorusses, etc., in the new pantomime of Harlequin Tour; or, the Dominion of Fancy, as performed at the Theatre Royal, Covent-Garden, etc.",,"London, 1800.",,,,,,,lsidyv2eb27209,pantomime,Music
014603008,|||,und,,,"Dibdin, Charles, 1745-1814.",standardised,1745,1814,Charles Dibdin,matched,Charles Dibdin,Q1064116,,"[Britons strike home.] Songs &c. in Britons strike home. A new entertainment of Sans Souci. Written, composed, spoken, sung, and accompanied by Mr. Dibdin. [electronic resource]","[Britons strike home.] Songs &c. in Britons strike home. A new entertainment of Sans Souci. Written, composed, spoken, sung, and accompanied by Mr. Dibdin.",,"[London : The Author, 1803.].",,,,,,,lsidyv2eb388b3,song,Music
014603017,|||,und,,,"HASTINGS, Mark.",unchanged,,,"HASTINGS, Mark.",none,,,,"Mark Hastings' Radical Songs for Working Men, etc. [electronic resource]","Mark Hastings' Radical Songs for Working Men, etc.",,"Hull : E. Wing & Son, 1885.",,,,,,,lsidyv2eb35911,song,Music
014603025,|||,und,,,"LINN, Harry.",unchanged,,,"LINN, Harry.",none,,,,[Harry Linn's Fire-Side Song Book.] [electronic resource],[Harry Linn's Fire-Side Song Book.],[Another edition.],[1887.],,,,,,,lsidyv2eb31987,song,Music
014603026,|||,und,,,"LOEWY, Albert.",unchanged,,,Albert Löwy,matched,Albert Löwy,Q18756563,,"מדת ימינו, שירת דודים לאחי ורעי Das Maass unserer Lebenstage. In sinngetreuer Übertragung des hebräischen Gedichtes. The Measure of our Days. A tri-lingual song, etc. Heb., Germ. & Eng. [electronic resource]","מדת ימינו, שירת דודים לאחי ורעי Das Maass unserer Lebenstage. In sinngetreuer Übertragung des hebräischen Gedichtes. The Measure of our Days. A tri-lingual song, etc. Heb., Germ. & Eng.",,"London, 1897.",,,,,,,lsidyv2eb345c3,song,Music
014603035,|||,und,,,"POTTER, R., of Scarning.",unchanged,,,"POTTER, R., of Scarning.",none,,,,"The Oracle concerning Babylon, and the Song of Exultation, from Isaiah, chap. xiii. and xiv., etc. [In verse.] [electronic resource]","The Oracle concerning Babylon, and the Song of Exultation, from Isaiah, chap. xiii. and xiv., etc. [In verse.]",,"London : G. and T. Wilkie, 1785.",,,,,,,lsidyv2eb34991,song,Music
014603252,|||,und,,,"FROME, Samuel Blake.",unchanged,,,"FROME, Samuel Blake.",none,,,,"The songs, odes, ballads, duets, and glees, in an opera, entitled: Sketches from life; or, The wandering Bard. [electronic resource]","The songs, odes, ballads, duets, and glees, in an opera, entitled: Sketches from life; or, The wandering Bard.",,"London, 1809.",,,,,,,lsidyv2eb3f6c6,opera,Music
014603271,|||,und,,,"Pope, Alexander, 1688-1744.",standardised,1688,1744,Alexander Pope,matched,Alexander Pope,Q164047,,"Windsor Forest by Alexander Pope, Esq. With a French translation by M. Viel de Boisjolin. New Song of Old Time, by M. De Segur, with the English translation by M. L. C. Esq. Cato's Soliloquy with the French translation by Major Howell. Henry the Fourth's Soliloquy with the French translation, also by Major Howell. [The translations in verse.] [electronic resource]","Windsor Forest by Alexander Pope, Esq. With a French translation by M. Viel de Boisjolin. New Song of Old Time, by M. De Segur, with the English translation by M. L. C. Esq. Cato's Soliloquy with the French translation by Major Howell. Henry the Fourth's Soliloquy with the French translation, also by Major Howell. [The translations in verse.]",,"London, 1799.",,,"VIEILH DE BOISJOLIN, Jacques François Marie.","VIEILH DE BOISJOLIN, Jacques François Marie.",single or unclear,,lsidyv2eb452e7,song,Music
014603274,|||,und,,,"Shakespeare, William, 1564-1616",standardised,1564,1616,William Shakespeare,matched,William Shakespeare,Q692,,"The Fairies. An opera, taken from A Midsummer Night's Dream ... As it is performed at the Theatre-Royal in Drury Lane. The songs from Shakespear, Milton, Waller, Dryden, Lansdown, Hammond, etc. [By David Garrick.] [electronic resource]","The Fairies. An opera, taken from A Midsummer Night's Dream ... As it is performed at the Theatre-Royal in Drury Lane. The songs from Shakespear, Milton, Waller, Dryden, Lansdown, Hammond, etc. [By David Garrick.]",,"London : J. & R. Tonson & S. Draper, 1755.",,,,,,,lsidyv2eb3be9b,opera,Music
014603275,|||,und,,,"Shakespeare, William, 1564-1616",standardised,1564,1616,William Shakespeare,matched,William Shakespeare,Q692,,The Tempest; an opera taken [by David Garrick] from Shakespear. As it is performed at the Theatre-Royal in Drury Lane. [electronic resource],The Tempest; an opera taken [by David Garrick] from Shakespear. As it is performed at the Theatre-Royal in Drury Lane.,,"London : J. & R. Tonson, 1756.",,,"Garrick, David, 1717-1779.","Garrick, David, 1717-1779.",single or unclear,,lsidyv2eb3c3cc,opera,Music
014603328,|||,und,,,,missing,,,,blank,,,,"Pills to expel Spleen, or a cure for the vapours: containing a collection of miscellaneous poems, &c. particularly some verses on the ... death of ... the Prince of Wales, and a satyrick song made on a noted Vintner on S. H., etc. [electronic resource]","Pills to expel Spleen, or a cure for the vapours: containing a collection of miscellaneous poems, &c. particularly some verses on the ... death of ... the Prince of Wales, and a satyrick song made on a noted Vintner on S. H., etc.",,"London, [1752?]",,,,,,,lsidyv2eb67d27,song,Music
014603333,|||,und,,,,missing,,,,blank,,,,"The Island of St. Marguerite, an opera, in two acts. [By the Hon. John St. John.] [electronic resource]","The Island of St. Marguerite, an opera, in two acts. [By the Hon. John St. John.]",,"London : Printed for J. Debrett, 1789.",,,"SAINT JOHN, John, Hon.","SAINT JOHN, John, Hon.",single or unclear,,lsidyv2eb84bcf,opera,Music
014603334,|||,und,,,"SAINT MAUR, Jane Anne Wilhelmina, Lady.",unchanged,,,"SAINT MAUR, Jane Anne Wilhelmina, Lady.",none,,,,"Sacred Songs, for the School at Teignrace. [electronic resource]","Sacred Songs, for the School at Teignrace.",,"Privately printed; London, 1836.",,,,,,,lsidyv2eb7b7f3,song,Music
014603403,|||,und,,,,missing,,,,blank,,,,"Melancthon's Ride from Bristol to Oxford, or the Church of England as it was, as it is, and as it ought to be, with a short answer to the shorter Question. Where is Popery? By Misoschismaticos. [Satirical verses directed against the Anti-Tractarians of Bristol.] [electronic resource]","Melancthon's Ride from Bristol to Oxford, or the Church of England as it was, as it is, and as it ought to be, with a short answer to the shorter Question. Where is Popery? By Misoschismaticos. [Satirical verses directed against the Anti-Tractarians of Bristol.]",,"Bristol : Privately printed, [1840?].",,,,,,,lsidyv2eb93d65,opera,Music
014603445,|||,und,,,,missing,,,,blank,,,,Highland Tales and Songs. [electronic resource],Highland Tales and Songs.,,"Glasgow, 1817.",,,,,,,lsidyv2eba0f7c,song,Music
014605602,|||,und,,,,missing,,,,blank,,,,The Lilly Dale Songster. [electronic resource],The Lilly Dale Songster.,,"London, [1858.]",,,,,,,lsidyv306c0e21,song,Music
014605603,|||,und,,,,missing,,,,blank,,,,Some old Love Songs. With designs by A. Havers. [electronic resource],Some old Love Songs. With designs by A. Havers.,,"London, Germany, [printed : Hildesheimer & Faulkner, 1892.].",,,"HAVERS, Alice.","HAVERS, Alice.",single or unclear,,lsidyv3141102b,song,Music
014605605,|||,und,,,,missing,,,,blank,,,,"The Magpie; or, the Maid of Palaiseau. A melodramatic romance. In three acts ... Second edition. [An adaptation of “La Pie voleuse,” by L. C. Caigniez and J. M. T. Baudouin d'Aubigny.] [electronic resource]","The Magpie; or, the Maid of Palaiseau. A melodramatic romance. In three acts ... Second edition. [An adaptation of “La Pie voleuse,” by L. C. Caigniez and J. M. T. Baudouin d'Aubigny.]",,"London : John Murray, 1815.",,,"Aubigny, M. d' -- CAIGNIEZ, Louis Charles, and BAUDOUIN D'AUBIGNY (Jean Marie Théodore)","Aubigny, M. d' -- CAIGNIEZ, Louis Charles, and BAUDOUIN D'AUBIGNY (Jean Marie Théodore)",multiple: dash + and,,lsidyv30134148,melody,Music
014605606,|||,und,,,"MILLER, Thomas, Miscellaneous Writer.",unchanged,,,"MILLER, Thomas, Miscellaneous Writer.",none,,,,Songs of the Seasons for my Children. Illustrated [by Birket Foster and Sir J. Gilbert]. [electronic resource],Songs of the Seasons for my Children. Illustrated [by Birket Foster and Sir J. Gilbert].,,"London, 1865.",,,"FOSTER, Birket. -- Gilbert, John, Sir, 1817-1897.","FOSTER, Birket. -- Gilbert, John, Sir, 1817-1897.",multiple: dash,,lsidyv30678840,song,Music
014605607,|||,und,,,,missing,,,,blank,,,,"Musick; or, a parley of instruments. [Songs, etc.] The first part. [electronic resource]","Musick; or, a parley of instruments. [Songs, etc.] The first part.",,"London, 1676.",,,,,,,lsidyv313e3142,song,Music
014605610,|||,und,,,"PINDER, Thomas.",unchanged,,,"PINDER, Thomas.",unreconciled,,,,Pinder's Yorkshire Pocket Song Book. no. 1. [electronic resource],Pinder's Yorkshire Pocket Song Book. no. 1.,,"Leeds : T. Pinder, [1884.].",,,,,,,lsidyv306f756f,song,Music
014605616,|||,und,,,,missing,,,,blank,,,,The Real Sensation Song Book for 1862. [electronic resource],The Real Sensation Song Book for 1862.,,"[London, 1862.]",,,,,,,lsidyv30633105,song,Music
014605621,|||,und,,,"TALLEY, William.",unchanged,,,"TALLEY, William.",none,,,,"The New Windsor Comic Songster ... By W. Talley, ... aided by his Wife (Eliza Talley). [electronic resource]","The New Windsor Comic Songster ... By W. Talley, ... aided by his Wife (Eliza Talley).",,"[Windsor,], 1872.",,,"TALLEY, Eliza.","TALLEY, Eliza.",single or unclear,,lsidyv3067c8f8,song,Music
014605629,|||,und,,,"Burns, Robert, 1759-1796",standardised,1759,1796,Robert Burns,matched,Robert Burns,Q81960,,"Festival in commemoration of Robert Burns, and to promote a subscription to erect a national monument to his memory at Edinburgh: held ... in London ... May 5, 1819, etc. [A list of toasts and words of songs sung at the dinner.] [electronic resource]","Festival in commemoration of Robert Burns, and to promote a subscription to erect a national monument to his memory at Edinburgh: held ... in London ... May 5, 1819, etc. [A list of toasts and words of songs sung at the dinner.]",,"London : B. McMillan, 1819.",,,,,,,lsidyv314e2e8a,song,Music
014605639,|||,und,,,"Collier, John Payne, 1789-1883",standardised,1789,1883,John Payne Collier,matched,John Payne Collier,Q2580079,,"Twenty-five Old Ballads and Songs: from manuscripts in the possession of J. P. Collier, etc. [Edited by J. P. Collier.] [electronic resource]","Twenty-five Old Ballads and Songs: from manuscripts in the possession of J. P. Collier, etc. [Edited by J. P. Collier.]",,"London : Printed for private circulation, 1869.",,,,,,,lsidyv3083e9e1,song,Music
014605658,|||,und,,,,missing,,,,blank,,,Society of Friends of Foreigners in Distress.,"Songs, duets, etc. in the grand miscellaneous concert at the King's Theatre on ... June the 3d, 1814 for the benefit of the Society of Friends of Foreigners in distress. [electronic resource]","Songs, duets, etc. in the grand miscellaneous concert at the King's Theatre on ... June the 3d, 1814 for the benefit of the Society of Friends of Foreigners in distress.",,"London, [1814.]",,,,,,,lsidyv32b5a831,song,Music
014605665,|||,und,,,"MORRIS, Charles, Captain.",unchanged,,,"MORRIS, Charles, Captain.",none,,,,"The Songs by Captain Morris, complete. The thirteenth edition, with additions. [electronic resource]","The Songs by Captain Morris, complete. The thirteenth edition, with additions.",,"London, 1793.",,,,,,,lsidyv314e5b7b,song,Music
014605684,|||,und,,,,missing,,,,blank,,,,The Tasmanian Songster. Third edition. [electronic resource],The Tasmanian Songster. Third edition.,,"[Hobart : M. Hornsby, 1868?].",,,,,,,lsidyv32b5a798,song,Music
014605687,|||,und,,,,missing,,,,blank,,,,The Old Dog Tray Songster. [electronic resource],The Old Dog Tray Songster.,,"London, [1858.]",,,,,,,lsidyv3074808c,song,Music
014608190,|||,und,,,"Dibdin, Charles, 1745-1814.",standardised,1745,1814,Charles Dibdin,matched,Charles Dibdin,Q1064116,,The Chelsea Pensioner: a comic opera in two acts. [By Charles Dibdin.] [electronic resource],The Chelsea Pensioner: a comic opera in two acts. [By Charles Dibdin.],,"London : G. Kearsley, 1779.",,,,,,,lsidyv3162011b,opera,Music
014608203,|||,und,,,,missing,,,,blank,,,,"The Songs in the Widow of Delphi: or, the Descent of the deities, a musical drama, of five acts [by Richard Cumberland]. Set to music by Mr. Thomas Butler, etc. [electronic resource]","The Songs in the Widow of Delphi: or, the Descent of the deities, a musical drama, of five acts [by Richard Cumberland]. Set to music by Mr. Thomas Butler, etc.",,"London : G. Kearsly, 1780.",,,"Cumberland, Richard, 1732-1811","Cumberland, Richard, 1732-1811",single or unclear,,lsidyv32b62ee9,song,Music
014608205,|||,und,,,"Dibdin, Charles, 1745-1814.",standardised,1745,1814,Charles Dibdin,matched,Charles Dibdin,Q1064116,,"Rose and Colin, a comic opera, in one act, etc. [Based on “Rose et Colas” by Michel Jean Sedaine.] [electronic resource]","Rose and Colin, a comic opera, in one act, etc. [Based on “Rose et Colas” by Michel Jean Sedaine.]",,"London : G. Kearsly, 1778.",,,"Sedaine, 1719-1797","Sedaine, 1719-1797",single or unclear,,lsidyv30949a17,opera,Music
014608206,|||,und,,,"Dibdin, Charles, 1745-1814.",standardised,1745,1814,Charles Dibdin,matched,Charles Dibdin,Q1064116,,"The Wives revenged; a comic opera, in one act, etc. [Based on “Les Femmes vengées” by Michel Jean Sedaine.] [electronic resource]","The Wives revenged; a comic opera, in one act, etc. [Based on “Les Femmes vengées” by Michel Jean Sedaine.]",,"London : G. Kearsly, 1778.",,,"Sedaine, 1719-1797","Sedaine, 1719-1797",single or unclear,,lsidyv32b630cf,opera,Music
014608218,|||,und,,,,missing,,,,blank,,,,"Songs, duetts, chorusses, etc. in the new operatick anecdote in three acts called Frederick the Great; or the Heart of a Soldier. [By S. J. Arnold.] [electronic resource]","Songs, duetts, chorusses, etc. in the new operatick anecdote in three acts called Frederick the Great; or the Heart of a Soldier. [By S. J. Arnold.]",,"London, 1814.",,,"Arnold, Samuel James, 1774-1852.","Arnold, Samuel James, 1774-1852.",single or unclear,,lsidyv32b63d88,opera,Music
014608229,|||,und,,,,missing,,,,blank,,,,"London Lampoon'd formerly in the Jacobite's Songs; and at present in a scandalous paper, call'd Heraclitus Ridens. With reflections upon both. [electronic resource]","London Lampoon'd formerly in the Jacobite's Songs; and at present in a scandalous paper, call'd Heraclitus Ridens. With reflections upon both.",,"London, 1703.",,"Periodical publications.- London. Heraclitus Ridens; or, A Discourse between Jest and Earnest, where many a True Word is spoken in opposition to all Libellers against the Government. [By Thomas Flatman.] 1 Feb. 1681-22 Aug. 1682. no. 1-82.",,,,,lsidyv30a26759,song,Music
014608230,|||,und,,,,missing,,,,blank,,,,"Songs, Duetts, Chorusses, etc., in the new comic Opera ... called Jean of Paris; taken from the French, etc. [electronic resource]","Songs, Duetts, Chorusses, etc., in the new comic Opera ... called Jean of Paris; taken from the French, etc.",,"London, 1814.",,,,,,,lsidyv309ac1e9,opera,Music
014608231,|||,und,,,"Kemble, John Philip, 1757-1823.",standardised,1757,1823,John Philip Kemble,matched,John Philip Kemble,Q1701422,,"Lodoiska; an Opera, in three acts [and in prose, with songs], etc. [electronic resource]","Lodoiska; an Opera, in three acts [and in prose, with songs], etc.",,"London, 1794.",,,,,,,lsidyv32b632f1,opera,Music
014608236,|||,und,,,,missing,,,,blank,,,,"Songs in Lodoiska, a musical romance, in three acts, etc. [By J. P. Kemble.] [electronic resource]","Songs in Lodoiska, a musical romance, in three acts, etc. [By J. P. Kemble.]",,"London, 1794.",,,"Kemble, John Philip, 1757-1823.","Kemble, John Philip, 1757-1823.",single or unclear,,lsidyv3099629e,song,Music
014608243,|||,und,,,,missing,,,,blank,,,,The New Year Songster. (A collection of favourite songs.). [electronic resource],The New Year Songster. (A collection of favourite songs.).,,"London : W. S. Fortey, [1892.].",,,,,,,lsidyv32b8c98b,song,Music
014608254,|||,und,,,,missing,,,,blank,,,,"The Watchword, or Quito-Gate; a melodrama in two acts [in prose] ... The second edition. [electronic resource]","The Watchword, or Quito-Gate; a melodrama in two acts [in prose] ... The second edition.",,"London, 1816.",,,,,,,lsidyv315ece33,melody,Music
014608262,|||,und,,,"SIDDONS, Henry.",unchanged,,,"SIDDONS, Henry.",none,,,,"The Sicilian Romance: or, The Apparition of the Cliffs, an opera [in three acts]. [electronic resource]","The Sicilian Romance: or, The Apparition of the Cliffs, an opera [in three acts].",,"London, 1794.",,,,,,,lsidyv32b631c8,opera,Music
014608264,|||,und,,,"Stanley, Henry M. (Henry Morton), 1841-1904.",standardised,1841,1904,Henry Morton Stanley,matched,Henry Morton Stanley,Q171421,,"Aurora Borealis; or, welcome song to the great African explorer H. M. Stanley from Iceland. [electronic resource]","Aurora Borealis; or, welcome song to the great African explorer H. M. Stanley from Iceland.",,"Reykjavik, 1890.",,,,,,,lsidyv32b8c952,song,Music
014608266,|||,und,,,"Thomas, John, rhymester.",unchanged,,,"Thomas, John, rhymester.",none,,,,"A Prophetical Love-Song by one of the Sons of Zion ... in his travel towards the Holy Land through the Wilderness, etc. [electronic resource]","A Prophetical Love-Song by one of the Sons of Zion ... in his travel towards the Holy Land through the Wilderness, etc.",,"London : Printed for the Author, 1661.",,,,,,,lsidyv3160f78e,song,Music
014608284,|||,und,,,,missing,,,,blank,,,,"Songs, Choruses, &c. in The Apparition! A musical dramatic romance, in two acts [by J. C. Cross], etc. [electronic resource]","Songs, Choruses, &c. in The Apparition! A musical dramatic romance, in two acts [by J. C. Cross], etc.",,"London : J. Barker, 1794.",,,"Cross, J. C. (James Cartwright), d. 1809.","Cross, J. C. (James Cartwright), d. 1809.",single or unclear,,lsidyv3098f4bb,song,Music
014608286,|||,und,,,"BATE, Henry, Rev., afterwards DUDLEY (Sir Henry Bate) Rev., Bart.",unchanged,,,"BATE, Henry, Rev., afterwards DUDLEY (Sir Henry Bate) Rev., Bart.",unreconciled,,,,"Airs, Duets, Trios, Glees, Chorusses, &c. in the Opera of the Travellers in Switzerland. [By Sir H. B. Dudley.] [electronic resource]","Airs, Duets, Trios, Glees, Chorusses, &c. in the Opera of the Travellers in Switzerland. [By Sir H. B. Dudley.]",,"London, 1794.",,,,,,Switzerland.,lsidyv315ab988,opera,Music
014608299,|||,und,,,"BURROWES, J.",unchanged,,,"BURROWES, J.",none,,,,"Life in St. George's Fields, or, the Rambles and adventures of disconsolate William, Esq.-from St. James's-and his accomplished Surrey friend, the Hon. Flash Dick ... Containing original songs ... and a slang dictionary, etc. [With a plate.] [electronic resource]","Life in St. George's Fields, or, the Rambles and adventures of disconsolate William, Esq.-from St. James's-and his accomplished Surrey friend, the Hon. Flash Dick ... Containing original songs ... and a slang dictionary, etc. [With a plate.]",,"London : J. Smith, 1821.",,,,,,,lsidyv33525f56,song,Music
014608326,|||,und,,,"Henry, Reginald.",unchanged,,,"Henry, Reginald.",none,,,,Songs without tunes. [electronic resource],Songs without tunes.,,[1893.],,,,,,,lsidyv335042cc,song,Music
014608337,|||,und,,,"Kenney, James.",unchanged,,,"Kenney, James.",none,,,,"[Matrimony: a petit opera in two acts [and in prose, with songs.] Altered from the French [of B. I. Marsollier des Vivetierès] ... The second edition.] [electronic resource]","[Matrimony: a petit opera in two acts [and in prose, with songs.] Altered from the French [of B. I. Marsollier des Vivetierès] ... The second edition.]",Third edition.,"London, 1804.",,,,,,,lsidyv3352a346,opera,Music
014608345,|||,und,,,"Dibdin, Charles, 1745-1814.",standardised,1745,1814,Charles Dibdin,matched,Charles Dibdin,Q1064116,,"The Mirror; or, Harlequin Every-where; a pantomimical burletta, in three parts [in prose and verse, by C. Dibdin]. [electronic resource]","The Mirror; or, Harlequin Every-where; a pantomimical burletta, in three parts [in prose and verse, by C. Dibdin].",,"London, 1779.",,,,,,,lsidyv33503601,pantomime,Music
014608357,|||,und,,,,missing,,,,blank,,,,"An Epistle [in verse] from Pindar to his pretended cousin Peter [i.e. J. Wolcot] ... With an appendix, containing Peter's celebrated song “O the roast pork of Old Truro,” etc. [electronic resource]","An Epistle [in verse] from Pindar to his pretended cousin Peter [i.e. J. Wolcot] ... With an appendix, containing Peter's celebrated song “O the roast pork of Old Truro,” etc.",,"London, 1788.",,,"PINDAR, Peter, pseud. [i.e. John Wolcot.].","PINDAR, Peter, pseud. [i.e. John Wolcot.].",single or unclear,,lsidyv32c2a34b,song,Music
014608369,|||,und,,,"Ritson, Joseph, 1752-1803.",standardised,1752,1803,ジョゼフ・リットソン,matched,ジョゼフ・リットソン,Q6286581,,"[Northern Garlands. The Bishopric Garland or Durham Minstrel. A choice collection of ... songs. The Yorkshire Garland ... The Northumberland, or Newcastle Nightingale ... The North-Country Chorister ... Edited by ... J. Ritson [and republished by J. H., i.e. Joseph Haslewood].] [electronic resource]","[Northern Garlands. The Bishopric Garland or Durham Minstrel. A choice collection of ... songs. The Yorkshire Garland ... The Northumberland, or Newcastle Nightingale ... The North-Country Chorister ... Edited by ... J. Ritson [and republished by J. H., i.e. Joseph Haslewood].]","[Another edition.] Northern Garlands, etc. L.P.","Edinburgh : E. & G. Goldsmid, 1887, 88.",,,,,,,lsidyv346031fa -- lsidyv33500098,song,Music
