Aleph system no.,Country code,Language code (008),Language code (041),DDC,Personal author,Author_review_status,Author_birth_year,Author_death_year,Author_name_clean,Author_reconciliation_status,Author_Wikidata_label,Author_Wikidata_QID,Corporate author,Title,Title_clean,Edition,Imprint,Series,Subjects,Other personal authors,Other_personal_authors_clean,Other_authors_structure,Other corporate authors,DOM ID,Type,Genre
014635254,|||,und,,,"AKENSIDE, Mark.",unchanged,,,Mark Akenside,matched,Mark Akenside,Q1247855,,[Hymn to the Naiads.] Alle Najadi. Inno alla Greca ... Recato in verso Italiano da T. J. Mathias. [electronic resource],[Hymn to the Naiads.] Alle Najadi. Inno alla Greca ... Recato in verso Italiano da T. J. Mathias.,,"Napoli, 1821.",,,"Mathias, Thomas James, 1754?-1835.","Mathias, Thomas James, 1754?-1835.",single or unclear,,lsidyv2af003b0,hymn,Music
014635258,|||,und,,,"ANDREWS, Miles Peter.",unchanged,,,Miles Peter Andrews,matched,Miles Peter Andrews,Q15454273,,"The Songs, recitatives, airs, duets, trios, and chorusses, introduced in the pantomime entertainment of The Enchanted Castle, etc. [electronic resource]","The Songs, recitatives, airs, duets, trios, and chorusses, introduced in the pantomime entertainment of The Enchanted Castle, etc.",,"London : The Author, 1786.",,,,,,,lsidyv3035631a,pantomime,Music
014635265,|||,und,,,"AXON, William Edward Armitage.",unchanged,,,Уильям Аксон,matched,Уильям Аксон,Q8004725,,Romany Songs Englished. [Reprinted from the “Journal of Gypsy Lore.”] [electronic resource],Romany Songs Englished. [Reprinted from the “Journal of Gypsy Lore.”],,[1890.],,,,,,,lsidyv2af0b50f,song,Music
014635279,|||,und,,,"BOISE, Otis Bardwell, Mrs.",unchanged,,,"BOISE, Otis Bardwell, Mrs.",none,,,,Song. The Life of Love is but a Day. [electronic resource],Song. The Life of Love is but a Day.,,"Boston : B. F. Wood Music Co., [1893.].",,,,,,,lsidyv2af0bc53,song,Music
014635281,|||,und,,,,missing,,,,blank,,,,"The Blind Boy: a melodrama, in two acts, etc. [By W. B. Hewetson.] [electronic resource]","The Blind Boy: a melodrama, in two acts, etc. [By W. B. Hewetson.]",,"London : Longman & Co., 1808.",,,,,,,lsidyv314dd1a8,melody,Music
014635286,|||,und,,,"Brooke, Frances, 1724?-1789.",manual review,,1789,"Brooke, Frances, 1724?-1789.",unreconciled,,,,"[Rosina, a comic opera ... The tenth edition.] [electronic resource]","[Rosina, a comic opera ... The tenth edition.]",The eleventh edition.,"London : T. Cadell, 1786.",,,,,,,lsidyv3a57f908,opera,Music
014635311,|||,und,,,,missing,,,,blank,,,,"Stanzas on the Death of the Princess Charlotte, with Claremonts' Bower, a ballad. Altered from the Irish Melodies. By the author of the verses on Madame Lavalette. Ascribed to Lord Byron. [electronic resource]","Stanzas on the Death of the Princess Charlotte, with Claremonts' Bower, a ballad. Altered from the Irish Melodies. By the author of the verses on Madame Lavalette. Ascribed to Lord Byron.",,"London : The Author, 1817.",,,,,,,lsidyv3a25152e,melody,Music
014635323,|||,und,,,"CRABTREE, John, of Lincoln.",unchanged,,,"CRABTREE, John, of Lincoln.",none,,,,A New Anthem or National Hymn of Praise and Thanksgiving. To commemorate Her Majesty Queen Victoria's long and most illustrious reign. [electronic resource],A New Anthem or National Hymn of Praise and Thanksgiving. To commemorate Her Majesty Queen Victoria's long and most illustrious reign.,,"Lincoln : Keyworth & Sons, [1896.].",,,,,,,lsidyv3a588cf1,hymn,Music
014635331,|||,und,,,"Dibdin, Charles, 1745-1814.",standardised,1745,1814,Charles Dibdin,matched,Charles Dibdin,Q1064116,,"[Most Votes.] Songs, &c. in Most Votes. A new entertainment of Sans Souci, written, composed, spoken, sung and accompanied by Mr. Dibdin. [electronic resource]","[Most Votes.] Songs, &c. in Most Votes. A new entertainment of Sans Souci, written, composed, spoken, sung and accompanied by Mr. Dibdin.",,"London : The Author, [1802.].",,,,,,,lsidyv39e7297a,song,Music
014635332,|||,und,,,"Dibdin, Charles, 1745-1814.",standardised,1745,1814,Charles Dibdin,matched,Charles Dibdin,Q1064116,,"[The Wedding Ring, a comic opera. In two acts, etc. [Based, in part, on “Il Filosofo di campagna” by Carlo Goldoni.]] [electronic resource]","[The Wedding Ring, a comic opera. In two acts, etc. [Based, in part, on “Il Filosofo di campagna” by Carlo Goldoni.]]",,"[41]. London, 1773.",,,,,,,lsidyv3a5378de,opera,Music
014635333,|||,und,,,"Dibdin, Thomas, 1771-1841.",standardised,1771,1841,Thomas John Dibdin,matched,Thomas John Dibdin,Q683268,,"Airs, Chorusses, &c. and a list of the scenery, in the new comic pantomime, called Harlequin in his Element, etc. (The pantomime invented by Mr. T. Dibdin.). [electronic resource]","Airs, Chorusses, &c. and a list of the scenery, in the new comic pantomime, called Harlequin in his Element, etc. (The pantomime invented by Mr. T. Dibdin.).",,"London : Appleyards, [1808.].",,,,,,,lsidyv306fb8b2,pantomime,Music
014635334,|||,und,,,"DIMOND, William.",unchanged,,,"DIMOND, William.",none,,,,"The Young Hussar, or Love and mercy, an operatic piece, in two acts, etc. [electronic resource]","The Young Hussar, or Love and mercy, an operatic piece, in two acts, etc.",,"London : Barker & Son, 1807.",,,,,,,lsidyv3143f959,opera,Music
014635357,|||,und,,,"GAY, John, the Poet.",unchanged,,,"GAY, John, the Poet.",unreconciled,,,,"Achilles in petticoats. An opera ... Written by Mr. Gay, with alterations [by George Colman, the elder]. [electronic resource]","Achilles in petticoats. An opera ... Written by Mr. Gay, with alterations [by George Colman, the elder].",,"W. Strahan, etc. : London, 1774.",,,"COLMAN, George, the Elder.","COLMAN, George, the Elder.",single or unclear,,lsidyv314c3262,opera,Music
014635361,|||,und,,,"GLADSTONE, Thomas Murray.",unchanged,,,"GLADSTONE, Thomas Murray.",none,,,,"The Captain's Cabin, or that's my Secret. A comedy of Life, in three acts ... with songs, music, etc. [electronic resource]","The Captain's Cabin, or that's my Secret. A comedy of Life, in three acts ... with songs, music, etc.",,"London, 1872.",,,,,,,lsidyv39f53140,song,Music
014635365,|||,und,,,,missing,,,,blank,,,,"[Well met, Gossip; or, 'Tis Merry when Gossips meet. Newly enlarged with very merry songs, pleasant for maids, wives, and widdows: and delightfull to all that shall read it. [By S. Rowlands.] B.L.] [electronic resource]","[Well met, Gossip; or, 'Tis Merry when Gossips meet. Newly enlarged with very merry songs, pleasant for maids, wives, and widdows: and delightfull to all that shall read it. [By S. Rowlands.] B.L.]",[Another edition.] 'Tis merry when Gossips meet.,"London : Chiswick Press, 1818.",,,"ROWLANDS, Samuel.","ROWLANDS, Samuel.",single or unclear,,lsidyv31612a2f,song,Music
014635376,|||,und,,,,missing,,,,blank,,,,"Harlequin Mungo; or, a Peep into the Tower: a new pantomimical entertainment in two acts [in prose and verse]. [electronic resource]","Harlequin Mungo; or, a Peep into the Tower: a new pantomimical entertainment in two acts [in prose and verse].",,"London, [1750?]",,,,,,,lsidyv314c9fbc,pantomime,Music
014635377,|||,und,,,"Harris, Augustus, Sir, 1852-1896.",standardised,1852,1896,Augustus Harris,matched,Augustus Harris,Q2917056,,The Rose of Castile: opera in three acts [and in prose]. [electronic resource],The Rose of Castile: opera in three acts [and in prose].,,"London, [1857.]",,,"FALCONER, Edmund, pseud. [i.e. Edmund O'Rourke.]","FALCONER, Edmund, pseud. [i.e. Edmund O'Rourke.]",single or unclear,,lsidyv39f25e10,opera,Music
014635392,|||,und,,,"Hook, Theodore Edward, 1788-1841.",standardised,1788,1841,Theodore Hook,matched,Theodore Hook,Q2117649,,"The Trial by Jury, a comic piece, in two acts [and in prose with songs]. [electronic resource]","The Trial by Jury, a comic piece, in two acts [and in prose with songs].",,"London, 1811.",,,,,,,lsidyv307d9706,song,Music
014635404,|||,und,,,,missing,,,,blank,,,India.,A Voyage to India. Containing fifteen ... songs in that favourite entertainment now performing by C. Incledon. [electronic resource],A Voyage to India. Containing fifteen ... songs in that favourite entertainment now performing by C. Incledon.,,"London, [1808?]",,,,,,,lsidyv30709ab3,song,Music
014635429,|||,und,,,"Dibdin, Charles, 1745-1814.",standardised,1745,1814,Charles Dibdin,matched,Charles Dibdin,Q1064116,,"Liberty Hall; or, A test of good fellowship. A comic opera, in two acts [and in prose. By C. Dibdin, the Elder]. [electronic resource]","Liberty Hall; or, A test of good fellowship. A comic opera, in two acts [and in prose. By C. Dibdin, the Elder].",,"London, 1785.",,,,,,,lsidyv308faca3,opera,Music
014635444,|||,und,,,,missing,,,,blank,,,,"Airs, songs, duetts, trios and chorusses in Marian, a comic opera in two acts. [By Frances Brooke.] [electronic resource]","Airs, songs, duetts, trios and chorusses in Marian, a comic opera in two acts. [By Frances Brooke.]",,"London, 1788.",,,"Brooke, Frances, 1724?-1789.","Brooke, Frances, 1724?-1789.",single or unclear,,lsidyv31ab110a,opera,Music
014635458,|||,und,,,"NEMO, Peter, Sir, Banneret, pseud.",unchanged,,,"NEMO, Peter, Sir, Banneret, pseud.",none,,,,"Political Pledges, or garbage to catch gudgeons; ... being a Tug for the Tories! Whipping for the Whigs!! and Rooting out of the Radicals!!! A new song, written by Sir Peter Nemo Banneret, ... and sung at the Conservative Banquet, on 13th June 1834. [electronic resource]","Political Pledges, or garbage to catch gudgeons; ... being a Tug for the Tories! Whipping for the Whigs!! and Rooting out of the Radicals!!! A new song, written by Sir Peter Nemo Banneret, ... and sung at the Conservative Banquet, on 13th June 1834.",,"[London?], 1834.",,,,,,,lsidyv2aeefde2,song,Music
014635476,|||,und,,,,missing,,,,blank,,,,"Songs, Chorusses, &c. in Peter the Great, or the Wooden Walls; an operatic drama, in three acts. [By A. Cherry.] [electronic resource]","Songs, Chorusses, &c. in Peter the Great, or the Wooden Walls; an operatic drama, in three acts. [By A. Cherry.]",,"London, 1807.",,,"Cherry, A. (Andrew), 1762-1812. -- Peter I, Emperor of Russia, 1672-1725.","Cherry, A. (Andrew), 1762-1812. -- Peter I, Emperor of Russia, 1672-1725.",multiple: dash,,lsidyv306c2b39,opera,Music
014635479,|||,und,,,,missing,,,,blank,,,,Phœbe. A pastoral opera [in three acts and in verse. By J. Hoadly]. [electronic resource],Phœbe. A pastoral opera [in three acts and in verse. By J. Hoadly].,,"London, 1748.",,,,,,,lsidyv307c250a,opera,Music
014635502,|||,und,,,"Dibdin, Charles, 1745-1814.",standardised,1745,1814,Charles Dibdin,matched,Charles Dibdin,Q1064116,,"The Quaker, a comic opera [in two acts and in prose and verse by Charles Dibdin]. Third edition. [electronic resource]","The Quaker, a comic opera [in two acts and in prose and verse by Charles Dibdin]. Third edition.",,"London, 1780.",,,,,,,lsidyv315c5068,opera,Music
014635510,|||,und,,,"ROLT, Richard.",unchanged,,,"ROLT, Richard.",unreconciled,,,,Two Hymns on the Nativity of Christ. [electronic resource],Two Hymns on the Nativity of Christ.,,"London : J. Newbery, 1751.",,,,,,,lsidyv2aef3100,hymn,Music
014635522,|||,und,,,"SIMPSON, John Palgrave.",unchanged,,,John Palgrave Simpson,matched,John Palgrave Simpson,Q6251798,,"Romance! A new operetta, composed by H. Leslie. The words by J. P. Simpson, etc. [electronic resource]","Romance! A new operetta, composed by H. Leslie. The words by J. P. Simpson, etc.",,"London, [1860.]",,,,,,,lsidyv39f385ea,opera,Music
014635541,|||,und,,,,missing,,,,blank,,,,"The Time-Gun. [A poem. Attributed in a MS. note on p. 4 to “the Revd Mr Cooper,” i.e. William Cowper.] [electronic resource]","The Time-Gun. [A poem. Attributed in a MS. note on p. 4 to “the Revd Mr Cooper,” i.e. William Cowper.]",,"[Edinburgh, 1866.]",,,"COWPER, William, Rev.","COWPER, William, Rev.",single or unclear,,lsidyv2af05080,opera,Music
014635547,|||,und,,,,missing,,,,blank,,,,"Valentine's Day; a musical drama in two acts [in prose, with songs, by W. Heard]. [electronic resource]","Valentine's Day; a musical drama in two acts [in prose, with songs, by W. Heard].",,"London, 1776.",,,,,,,lsidyv307b6e2e,song,Music
014635549,|||,und,,,,missing,,,,blank,,,,"[The Carnival of Venice.] Songs, ... &c., in the comic Opera of the Carnival of Venice. [By R. Tickell.] [electronic resource]","[The Carnival of Venice.] Songs, ... &c., in the comic Opera of the Carnival of Venice. [By R. Tickell.]",,"London, 1781.",,,"TICKELL, Richard.","TICKELL, Richard.",single or unclear,,lsidyv31b15b09,opera,Music
014635561,|||,und,,,"WHITEMAN, J. C.",unchanged,,,"WHITEMAN, J. C.",none,,,,"J. C. Whiteman's ... Book of Popular Original Songs, etc. [electronic resource]","J. C. Whiteman's ... Book of Popular Original Songs, etc.",,"Leeds : Nutt & Co., [1896.].",,,,,,,lsidyv2af0bd3e,song,Music
014643313,|||,und,,,"Savage-Armstrong, George Francis, 1845-1906.",standardised,1845,1906,George Savage-Armstrong,matched,George Savage-Armstrong,Q18922289,,"Victoria Regina et Imperatrix. A jubilee song from Ireland, 1887. [electronic resource]","Victoria Regina et Imperatrix. A jubilee song from Ireland, 1887.",,"London : Longmans & Co., 1887.",,,"Victoria, Queen of Great Britain, 1819-1901.","Victoria, Queen of Great Britain, 1819-1901.",single or unclear,,lsidyv3a9e3dd4,song,Music
014643323,|||,und,,,,missing,,,,blank,,,,"An English Psalm. Or, a hymn on the late Thanksgiving-Day: being a Protestant version of the Second Psalm. By Mr. Brereton. [In verse.] [electronic resource]","An English Psalm. Or, a hymn on the late Thanksgiving-Day: being a Protestant version of the Second Psalm. By Mr. Brereton. [In verse.]",,"London : Jonas Brown, 1716.",,,"BRERETON, Thomas, of Brasenose College, Oxford.","BRERETON, Thomas, of Brasenose College, Oxford.",single or unclear,,lsidyv3a925fef,hymn,Music
014643355,|||,und,,,"CHRISTY, Edwin Pearce.",unchanged,,,Edwin Pearce Christy,matched,Edwin Pearce Christy,Q5346741,,"The Original Christy's Minstrels. Complete repertoire of plantation melodies, from which the programme of each evening is selected. [electronic resource]","The Original Christy's Minstrels. Complete repertoire of plantation melodies, from which the programme of each evening is selected.",,"[London : W. B. Ford, 1857.].",,,,,,,lsidyv3a8ad7e6,melody,Music
014643381,|||,und,,,"Diprose, John.",unchanged,,,John Diprose,matched,John Diprose,Q114045777,,Diprose's 19th Century Song Book. The Victories of Old England from 1346 to 1874. [electronic resource],Diprose's 19th Century Song Book. The Victories of Old England from 1346 to 1874.,,"[London, 1878.]",,,,,,,lsidyv3abf106e,song,Music
014643402,|||,und,,,"GATES, Hartley Baxter.",unchanged,,,"GATES, Hartley Baxter.",none,,,,"Woman's Resolve; or, Me, Woman versus Me, Man. A rallying song for women. (Addenda.). [electronic resource]","Woman's Resolve; or, Me, Woman versus Me, Man. A rallying song for women. (Addenda.).",,"[H. B. Gates: Stanstead, Quebec, 1898.]",,,,,,,lsidyv3a99d31a,song,Music
014643420,|||,und,,,,missing,,,,blank,,,,Golden Harvest. A daily companion containing Scripture texts and hymns [by various authors] for a month. [Illustrated.] [electronic resource],Golden Harvest. A daily companion containing Scripture texts and hymns [by various authors] for a month. [Illustrated.],,"London; Nuremberg printed : E. Nister, [1894.].",,,,,,,lsidyv3a98b79a,hymn,Music
014643437,|||,und,,,,missing,,,,blank,,,,"A Hunting Song; written in commemoration of a most famous Fox Chace, run by the Duke of Rutland's Hounds, December the 10th, 1805. [electronic resource]","A Hunting Song; written in commemoration of a most famous Fox Chace, run by the Duke of Rutland's Hounds, December the 10th, 1805.",,"[London : J. Brettell, 1810?].",,,,,,,lsidyv3a99033a,song,Music
014643438,|||,und,,,"JACKSON, Richard Charles.",unchanged,,,Richard Jackson,matched,Richard Jackson,Q18687967,,The Risen Life. Hymns and poems for the Christian year-Easter to Advent. [electronic resource],The Risen Life. Hymns and poems for the Christian year-Easter to Advent.,,"London : Masters & Co., 1883.",,,,,,,lsidyv3a99b4c1,hymn,Music
014643445,|||,und,,,,missing,,,,blank,,,,His Loving Kindness. A daily companion; containing Scripture texts and hymns [by various authors] for a month. [Illustrated.] [electronic resource],His Loving Kindness. A daily companion; containing Scripture texts and hymns [by various authors] for a month. [Illustrated.],,"London; Nuremberg printed : E. Nister, [1894.].",,,,,,,lsidyv3a98b701,hymn,Music
014643447,|||,und,,,"LAMB, James, Comedian.",unchanged,,,"LAMB, James, Comedian.",none,,,,"A small collection of original pieces (in verse), consisting of epistles, songs, rural ballads, and hymns. [electronic resource]","A small collection of original pieces (in verse), consisting of epistles, songs, rural ballads, and hymns.",,"[London?] : Privately printed, 1819.",,,,,,,lsidyv3a8acc82,hymn,Music
014643449,|||,und,,,"LAWTON, Alexander.",unchanged,,,Alexander Lawton,matched,Alexander Lawton,Q3719981,,Rollin Rone; or the Adventures of a Toper. A satirical poem. Night the first. [electronic resource],Rollin Rone; or the Adventures of a Toper. A satirical poem. Night the first.,,"London, 1847.",,,,,,,lsidyv3abefb91,opera,Music
014643461,|||,und,,,"LYTTEL, Edward Zechariah.",unchanged,,,"LYTTEL, Edward Zechariah.",none,,,,High in our Fatherland. A Christian melody. [electronic resource],High in our Fatherland. A Christian melody.,,"London : Novello & Co., [1885.].",,,,,,,lsidyv3a9748ac,melody,Music
014643526,|||,und,,,"POCOCK, Isaac.",unchanged,,,"POCOCK, Isaac.",none,,,,"Twenty Years Ago! A new melodramatic entertainment, in two acts [in prose], etc. [electronic resource]","Twenty Years Ago! A new melodramatic entertainment, in two acts [in prose], etc.",,"London, 1810.",,,,,,,lsidyv3a8c5741,melody,Music
014643530,|||,und,,,"POTTER, Robert, Prebendary of Norwich.",unchanged,,,"POTTER, Robert, Prebendary of Norwich.",none,,,,[A Farewell Hymne to the Country. Attempted in the manner of Spenser's Epithalamion.] [electronic resource],[A Farewell Hymne to the Country. Attempted in the manner of Spenser's Epithalamion.],Second edition.,"London, 1750.",,,,,,,lsidyv3a9fdf89,hymn,Music
014643545,|||,und,,,,missing,,,,blank,,,,"Risum teneatis? Amici: or, A True and diverting account of a late battle between a priest and a porter. In Hudibrastick verse. Address'd to the Orator of Clare-Market. [By Henry Price.] To which is added, the Fat vicar's race: or, a merry new song of a wager between Parson V-gh-n [i.e. Vaughan] ... and a gentleman in Staffordshire which was won by the former. Wrote by a gentleman, who saw the race performed. [electronic resource]","Risum teneatis? Amici: or, A True and diverting account of a late battle between a priest and a porter. In Hudibrastick verse. Address'd to the Orator of Clare-Market. [By Henry Price.] To which is added, the Fat vicar's race: or, a merry new song of a wager between Parson V-gh-n [i.e. Vaughan] ... and a gentleman in Staffordshire which was won by the former. Wrote by a gentleman, who saw the race performed.",,"[London] : J. Roberts, 1732.",,,"PRICE, Henry, Poetical Writer.","PRICE, Henry, Poetical Writer.",single or unclear,,lsidyv3abe4eaf,song,Music
014643613,enk,eng,,,"WALDRON, Francis Godolphin.",unchanged,,,Francis Godolphin Waldron,matched,Francis Godolphin Waldron,Q5481098,,"Songs, glees, &c. in a comick opera [by Francis G. Waldron] call'd The miller's maid. Founded on one of the admired “Rural tales,” written by Mr. Robert Bloomfield, etc. [electronic resource]","Songs, glees, &c. in a comick opera [by Francis G. Waldron] call'd The miller's maid. Founded on one of the admired “Rural tales,” written by Mr. Robert Bloomfield, etc.",,"The Author : London, [1804].",,,"BLOOMFIELD, Robert, Poet.","BLOOMFIELD, Robert, Poet.",single or unclear,,lsidyv3a97694c,opera,Music
014643614,|||,und,,,,missing,,,,blank,,,,Walking in the Light. A daily companion containing Scripture texts and hymns for a month. [Illustrated.] [electronic resource],Walking in the Light. A daily companion containing Scripture texts and hymns for a month. [Illustrated.],,"London; Nuremberg printed : E. Nister, [1894.].",,,,,,,lsidyv3a98bb93,hymn,Music
014643624,|||,und,,,"WOODWARD, Henry, Comedian.",unchanged,,,"WOODWARD, Henry, Comedian.",none,,,,"Songs, choruses, etc. ... in ... Harlequin's Jubilee, etc. [electronic resource]","Songs, choruses, etc. ... in ... Harlequin's Jubilee, etc.",,"London, 1770.",,,,,,,lsidyv3a9a2395,song,Music
014750936,|||,eng,,,,missing,,,,blank,,,,"An Account of the Estates, Trust, and other property, belonging to the Parish of St. Giles, Camberwell. [electronic resource]","An Account of the Estates, Trust, and other property, belonging to the Parish of St. Giles, Camberwell.",,"London, 1818.",,,,,,,lsidyv306bd8b5,opera,Music
014750948,|||,eng,,,"SMITH, George, of Coalville, Leicester.",unchanged,,,"SMITH, George, of Coalville, Leicester.",none,,,,"Gypsy Children; or, a Stroll in Gypsydom. With songs and stories [and musical notes], etc. [electronic resource]","Gypsy Children; or, a Stroll in Gypsydom. With songs and stories [and musical notes], etc.",,"London : Woodford, Fawcett & Co., [1889]",,,,,,,lsidyv30794b2a,song,Music
014756181,|||,eng,,,"GOICOECHEA, Sotero de.",unchanged,,,"GOICOECHEA, Sotero de.",none,,,,"A luminous guide for the British cooperative forces in Spain ... with particular information relative to the Basque Provinces [followed by an English and Spanish, and an English, Spanish and Basque vocabulary], etc. [electronic resource]","A luminous guide for the British cooperative forces in Spain ... with particular information relative to the Basque Provinces [followed by an English and Spanish, and an English, Spanish and Basque vocabulary], etc.",,"Bayonne, 1836.",,,,,,,lsidyv3bfa0620,opera,Music
014756366,|||,eng,,,"SMITH, George, of Coalville, Leicester.",unchanged,,,"SMITH, George, of Coalville, Leicester.",none,,,,"[Gypsy Children; or, a Stroll in Gypsydom. With songs and stories [and musical notes], etc.] [electronic resource]","[Gypsy Children; or, a Stroll in Gypsydom. With songs and stories [and musical notes], etc.]",New edition.,"London : W. Fawcett & Co., [1891.].",,,,,,,lsidyv3c0f3b42,song,Music
014767507,|||,eng,,,"BEST, William, B.A., Minister of South Parade Chapel, Leeds.",unchanged,,,"BEST, William, B.A., Minister of South Parade Chapel, Leeds.",none,,,,"The Question of the Day. Church Property: what is it, and whose? A paper, etc. [electronic resource]","The Question of the Day. Church Property: what is it, and whose? A paper, etc.",,"Leeds : [The Author], 1868.",,,,,,,lsidyv3c3a9e34,opera,Music
014767549,|||,eng,,,"BURT, Charles, Alderman of Richmond, Surrey.",unchanged,,,"BURT, Charles, Alderman of Richmond, Surrey.",none,,,,The Richmond Vestry. Notes of its history and operations from 1614 to 1890. (Borough of Richmond. The charter of incorporation. [With a map.]). [electronic resource],The Richmond Vestry. Notes of its history and operations from 1614 to 1890. (Borough of Richmond. The charter of incorporation. [With a map.]).,,"Richmond : R. A. Darnill, 1890.",,,,,,,lsidyv3c36d333,opera,Music
014767670,|||,eng,,,,missing,,,,blank,,,,"Election Budget of Squibs, Songs, &c. published during the contest ... at Norwich ... June, 1818, etc. [electronic resource]","Election Budget of Squibs, Songs, &c. published during the contest ... at Norwich ... June, 1818, etc.",,"Norwich : R. Lane, [1818]",,,,,,,lsidyv3c25c519,song,Music
014767697,|||,eng,,,,missing,,,,blank,,,,"How to Obtain Cheap Flour; or, a few remarks upon the objects ... to be gained from the establishment of co-operative flour-mills ... By An Unobserved Observer. [electronic resource]","How to Obtain Cheap Flour; or, a few remarks upon the objects ... to be gained from the establishment of co-operative flour-mills ... By An Unobserved Observer.",,"Doncaster : Printed for the Author, 1856.",,,,,,,lsidyv3c3d4804,opera,Music
014767892,|||,eng,,,,missing,,,,blank,,,,"An Abstract of Accounts for fourteen years ending Whitsuntide, 1840 ... relative to Property under the management of the Pious Use Trustees, etc. [electronic resource]","An Abstract of Accounts for fourteen years ending Whitsuntide, 1840 ... relative to Property under the management of the Pious Use Trustees, etc.",,"Leeds : Hobson and Smiles, 1841.",,,,,,,lsidyv3c347a87,opera,Music
014768095,|||,eng,,,,missing,,,,blank,,,,"The progress of Popery, and the means of resisting it considered, in a letter to the Vicar of Scarborough. By a Protestant. [electronic resource]","The progress of Popery, and the means of resisting it considered, in a letter to the Vicar of Scarborough. By a Protestant.",,"London : Manning & Mason, 1838.",,,,,,,lsidyv3c38c2dc,opera,Music
014768173,|||,eng,,,"SMITH, George, F.A.S.",unchanged,,,"SMITH, George, F.A.S.",none,,,,"The Cassiterides: an inquiry into the commercial operations of the Phœnicians in Western Europe, with particular reference to the British tin trade. [electronic resource]","The Cassiterides: an inquiry into the commercial operations of the Phœnicians in Western Europe, with particular reference to the British tin trade.",,"London, 1863.",,,,,,,lsidyv3c2ef36e,opera,Music
014768208,|||,eng,,,"TEALE, Thomas Pridgin, the Elder.",unchanged,,,"TEALE, Thomas Pridgin, the Elder.",unreconciled,,,,On a plastic operation for the restoration of the lower lip. [electronic resource],On a plastic operation for the restoration of the lower lip.,,"London : Printed by J. E. Adlard, 1855.",,,,,,,lsidyv3c3d47b3,opera,Music
014774021,|||,und,,,"Brooke, Frances, 1724?-1789.",manual review,,1789,"Brooke, Frances, 1724?-1789.",unreconciled,,,,"[Rosina, a comic opera ... The tenth edition.] [electronic resource]","[Rosina, a comic opera ... The tenth edition.]",The twelfth edition.,"London : T. Cadell, 1788.",,,,,,,lsidyv3a57fa3d,opera,Music
